titles,category
국민의힘  도망 다니다 책임 덜기 위해 나선 이재명  볼썽사나워 ,Politics
   심판       심판  총선 전 마지막 국감    일 개막,Politics
  대통령 지지율       소폭 상승   국힘       민주      ,Politics
최전방 찾은 신원식  즉각  강력히  끝까지 응징  원칙 재강조,Politics
청문회  엑시트 한 김행  국힘  가짜뉴스  민주  행방불명 ,Politics
 첫째도 둘째도 셋째도 응징  이스라엘 전쟁 상황서 최전방 부대 간 신원식의 주문,Politics
하태경 저격한 홍준표에  천하람  사감 앞세워 깎아내리지 말라 ,Politics
국민의힘  퇴원 후 강서가는 이재명에  주민들 속만 뒤집어놓을 것 ,Politics
여야  국정감사 주도권 잡기 사활   이재명 오늘 퇴원,Politics
여야  국정감사 주도권 잡기 사활   이재명 오늘 퇴원,Politics
 단독 자유총연맹 총재  끼 평균   만원 급식비   소속 강사엔 국고 지원,Politics
   하태경  살길 찾는 것        영남 무소속 출마보다 나아  저격,Politics
전여옥도 반대하는 김행  조국 보다 빨리 물러날 수도 ,Politics
신원식  첫 최전방 대비태세 점검  적 도발 즉각  강력히  끝까지 응징 ,Politics
민주      행방불명  김행 임명 강행이 웬 말 국민심판 부를 것 ,Politics
전여옥마저   김행 임명 거둬들여야     일 조국 보다 더 빨리 물러날 수도 ,Politics
 이첩 중단  지시도 항명  박 대령 공소사실도 논란,Politics
김행 임명은 숙고하는 용산 강행 결론 쉽지 않은 이유,Politics
하태경 꼬집은 홍준표에 천하람  사감 앞세우지 마라  직격,Politics
   퇴원하고 강서 가는 이재명  주민 속만 뒤집어놓을 것 ,Politics
장예찬  제   제 의 하태경 나와야 나도 자객하라면 할 것 ,Politics
내일부터   대 마지막 국감   여야  극한 대치 예고,Politics
대통령실  이균용 낙마에  헌재소장 인선작업도 어려워 ,Politics
윤석열 정부 검찰의  수사의 정치화   어디까지 갈까 ,Politics
홍석준  이재명   김포공항 이전  백지화 입장부터 밝혀라 ,Politics
천하람  하태경 꼬집은  시장에  왜 사감 앞세우나 ,Politics
본지 보도대로 이재명  오늘 강서 보궐 집중유세 결합,Politics
이재명도 등판한다 여야   사전투표율 최고  강서구 보선 막판 총력,Politics
국힘  이재명 강서구청장 선거 지원  얄팍한 꼼수 ,Politics
이재명  오늘 오후 퇴원 강서구청장 선거 유세장부터 찾는다,Politics
여당  민주 지지자  김태우 후보 측 위협  선거테러  대국민 사과해야 ,Politics
 퇴원  이재명  강서구청장 유세 현장 부터    꼼수 ,Politics
이재명  오후 녹색병원 퇴원 후 강서구청장 유세 지원,Politics
  만원짜리 로켓에 깨진 아이언 돔  서울 하늘은 안전한가,Politics
탈북 국군포로 한병수 씨   세 일기로 별세,Politics
 정치쇼  전원책  김행이 들으면 섭섭하겠지만    한번 정도 양보해야 ,Politics
서영교   한일전 야구 승리 금메달  오기 해프닝에 네티즌  뭇매 ,Politics
이재명  오늘 퇴원  오후  시 발산역서 강서구청장 유세 지원 ,Politics
천하람  하태경 사례 귀해 홍준표  사감 앞세우지 마라 ,Politics
홍준표  하태경 제살길 찾기  천하람  사감 앞세워 깎아내려 ,Politics
전여옥  김행  조국보다 빨리 물러날 수도 장관직 임명 철회해야 ,Politics
 요격률     자랑하더니  하마스 공격에 무용지물  아이언돔   왜  이현호 기자의 밀리터리 톡 ,Politics
역대 재보궐 중 최고   강서구청장 사전투표율 해석 여야  각자 물대기 ,Politics
하태경  해운대서  선까지만 한다는 건 오랜 소신 정치혁신 ,Politics
하태경  서울 출마 에 김병민  소식 듣자마자  존경한다  문자 ,Politics
   신원식 유인촌 이어 김행  정면돌파  나설까,Politics
이재명  여의도 복귀 초읽기 강서구청장 선거 지원 나설까,Politics
강서구청장 보궐선거 총력전  이재명 등판할까 ,Politics
전여옥  김행 사퇴 촉구    일 만에 사임한 조국보다 더 빨리 물러날 수도 ,Politics
    시행사에 분양한 공공주택용지 연체금  조   억원   배 ,Politics
홍석준  이재명   김포공항 이전  공약에 답해야 ,Politics
 단독 알리익스프레스 상륙 후 중국발 짝퉁  배 늘었다,Politics
 정치쇼  김병민  하태경  큰 그림 있었구나  장경태  김기현   장제원은  ,Politics
     김태우  빌라촌 유세  진교훈    시간 진심유세 ,Politics
하태경  해운대서  선까지만 한다는 게 내 소신   굵직한 공약 이행 ,Politics
 단독  원희룡   휴게소 밥값 인하   차례 구두회의로 졸속 결정,Politics
 단독  신현영  내일  청문회 줄행랑  김행 방지법 발의한다,Politics
전여옥  김행  의혹에 대해 방어 못하고 딴소리만 사퇴하라 ,Politics
   세 번째 군사정찰위성은 언제 러시아  군사원조  기다리나,Politics
    발에 구멍난 아이언돔   시간당  만    발  장사정포 대응은 ,Politics
 이재명 방탄      인사참사   계속되는 이균용 부결 사태,Politics
홍석준  민주  이재명  김포공항 이전  백지화 입장 밝혀야 ,Politics
안철수 김은혜 격돌  분당갑 관전 포인트는 윤심,Politics
장예찬  제   제 의 하태경 나와야 중진들 고민해줬으면 ,Politics
홍익표  당에 도움 안되는 사람에게 공천 줄 수 없다 ,Politics
 김행랑  논란에 용혜인  언론 카메라 빠지니 돌변 ,Politics
홍준표  하태경에  선당후사  제 살길 찾는 것 ,Politics
월 최대    만 원까지 대학보다 비싼 영유아 영어학원,Politics
장예찬  제    의 하태경 나오는 게 총선에 긍정적 ,Politics
 최강시사  용혜인  김행  이 상태로 장관된다한들 존중 아닌 조롱 받을 것 ,Politics
홍익표  내년 총선  당 도움 안 되는 이에게 공천 줄수 없어 ,Politics
양평군  공흥지구 특혜의혹 기소공무원 징계 안 해  시효 지나 ,Politics
 안갯속  선거제 개편 제 지대  거대 양당 틈새  찾을까,Politics
예술의전당 간 한동훈   인기 폭발      총선 간보러 ,Politics
대법원장 부결 김행 퇴장 여진  이재명 방탄   인사 참사 ,Politics
홍익표  당에 도움 안되면 공천 못줘  체포 가결파에 경고 ,Politics
 정치쇼   헤즈볼라가 간 보고 있지만 중동전쟁 확전 가능성은 없다 ,Politics
총선까지 남은 반년 변수는 공천 계파 갈등 무당층 표심,Politics
 지지율  소폭 올라       여야 지지율 보합세  리얼미터 ,Politics
   이스라엘 사태 속  슈퍼 핵 항모  제럴드 포드 전진배치,Politics
내일부터 국감  문재인   윤석열 정부 실정론    이재명    한동훈  격돌,Politics
대법원장 공석 이재명 수사   대 마지막 법사위 국감   일 시작,Politics
 추석 민생 행보로 상승    지지율       부정평가는      로 줄여져,Politics
  월  일 채널  라디오쇼  정치시그널  인터뷰 전문,Politics
장예찬  김행 줄행랑 아냐  그날 밤  시간 대기했어 ,Politics
러와   년 위성 발사 계약  고육지책     누리호 활용과 엇박자 ,Politics
전여옥  김행  조국보다 빨리 물러날 수도 임명 철회해야 ,Politics
윤 대통령 지지율        올라       국힘       민주      ,Politics
     때 호주 이 큰 희생 끝에 점령한 마량산 아시나요,Politics
 천 개의 바람이 되어   아웅산 순국선열   주기 맞아,Politics
 정진상 안아보고 싶다     일 만에 법정 선 이재명의 부탁,Politics
 차라리 탕후루 열풍을  차이나 게이트 라 하는 게  ,Politics
추석 민생 행보 통했나   지지율        오른      ,Politics
 정치쇼  가자지구 최인접 지역 교민  집 근처에도 로켓 떨어져 ,Politics
대통령 명예훼손   처벌 의사  안 밝혀도 처벌 가능할까,Politics
홍준표  하태경 서울 출마가 선당후사  공천 자신 없자 제 살길 찾는 것 ,Politics
홍익표  당에 도움이 안 되는 사람한테 공천 줄 수 없을 것 ,Politics
 윤석열 정부와 여당은 한심하고    말말말 ,Politics
이재명  여의도 복귀 준비 병상서 당 통합 숙고,Politics
고소득자 병적관리 연 종합소득   억  억원으로 크게 강화한다,Politics
국민의힘       민주       무당층       리얼미터 ,Politics
 단독   군 미래가 없다  사관학교 출신   년간    명 조기전역 이현호 기자의 밀리터리 톡 ,Politics
  지지율        오른       여야 지지율 보합세 리얼미터 ,Politics
민주 홍익표  당에 도움 안 되는 사람한테 공천 줄 수 없을 것 ,Politics
   한동훈 법무부 장관 탄핵 카드 꺼낼까,Politics
대법원장 부결 김행 퇴장 여진  이재명 방탄   인사 참사 ,Politics
홍익표  당에 도움 안 되는 사람 공천 못 줘  이재명 체포안 가결파에 일침,Politics
 야당 텃밭 에 당력 쏟은   강서 보선 승패 파장은,Politics
기업총수들 국감 줄소환  탕후루 대표 마약 아이돌 도 호출,Politics
민주 지도부  강서 총집결 이재명 막판  깜짝 유세  나설까,Politics
하태경  탈부산  외쳤다  비윤   비명  긴장하나,Politics
  대 마지막 국감 내일 개막 여야     정부 실정론 격돌,Politics
 개월 남은   대 총선  정권 심판론  거야 심판론  충돌,Politics
 부산  선  하태경 서울로  김두관   도 변화를   새판짜기 신호탄,Politics
 맨땅 헤딩 모래주머니 차고 뛰는 기분  신인  인의 호소  기득권 선거법   ,Politics
그동안   차대전때 잠수함  썼다고  대만  자국산  호  진수  밀리터리 브리핑 ,Politics
총선 반년 앞인데 선거구   곳  미확정    정치 신인은 패닉상태  기득권 선거법   ,Politics
 당론 부결 후폭풍 대법원장 헌재소장  초유의 동시공백  가나,Politics
고소득자 병적관리 기준소득 연   억  억원으로 강화한다,Politics
트럼프와 브로맨스 김정은  다시  꿈 꿀까,Politics
 도 남침 땐 이 작전 쓴다 이스라엘 허 찌른  로켓 게릴라  ,Politics
강서구 보선  역대급 사전투표율            여야  우리가 더 유리 ,Politics
강서의 선택 이틀 앞둔      한표라도 더  저인망식 표심훑기,Politics
신원식 임명한 윤 대통령  김행 임명도 강행할 전망,Politics
 단독  박광온 전 민주 원내대표단  사퇴  주 만에 비공개 회동,Politics
하태경   정부 혜택 받은 분들  기득권 버리고 총선 헌신해야 ,Politics
신원식 유인촌 장관 임명  김행은 국회 상황 보며 결정할 듯,Politics
 오영환   지지자 흉기 테러 죄송  햄버거    개 들고 경찰 방문,Politics
 에 억류된 우리 국민  명   생사라도 확인해달라 ,Politics
지역구 경쟁자까지 국감 불러  흠집내기  증인 신청 논란,Politics
시간당  만발 퍼붓는  장사정포  한국도 비상,Politics
 단독 음주운전 몰카 등 징계받은 판사   명  성과금도 챙겼다,Politics
 서울 출마 선언  하태경  중진 물갈이론 부산 여권 촉각,Politics
신원식 유인촌 이어 김행도 임명할듯      은 철회를 ,Politics
강서구청장 사전투표율            보수결집     정권심판 ,Politics
엑스포 개최지 투표       막판 뒤집기 총력 ,Politics
검찰의 넘치는 소명의식  이재명 혐의 소명은 못해,Politics
  친윤 비윤   친명 비명  총선  계파갈등 극복에 달렸다,Politics
기사회생 이재명  당무 복귀 후  봉합  칼춤   갈림길,Politics
     투표에 화들짝  김태우  형  뮤비  진교훈  청년기본소득 ,Politics
문제는 경제야  바보야   편집인의 원픽 ,Politics
강서구청장 보궐선거 막판 표심 잡기   총선    개월,Politics
체포동의안 가결표 색출  총선에도 영향   홍익표  정치적 해법도 있다 ,Politics
총선  개월 앞    표심  엎치락뒤치락   여야  무당층 잡아라 ,Politics
 김행 인사청문회 파행  여파      임명 강행할까 ,Politics
김태우 선거운동원에  난 민주당이다    아  신발로 위협하며 욕설,Politics
 서울 출마  선언한 부산  선 하태경 총선 앞 여당  험지 출마론  불 댕기나,Politics
 김행랑  논란에도 강행 기류  요지부동  인사 독주,Politics
역대급 사전투표율 야  정부심판론 먹혀  여  열어봐야 안다 ,Politics
민주당  이재명에 막말 김태우  대통령 사면받으니 눈에 보이는 게 없나 ,Politics
국민의힘   지도부 총출동  고공전 이재명 없는 민주당   저인망식  선거운동,Politics
홍익표  당에 도움 안 되는 사람에게 공천 못 준다 ,Politics
강서구청장 보선 사전투표  열기  여  민주당 심판  야  정권 심판 ,Politics
 정치톡톡  또다시 강서 찾은 김기현   이재명 당무 복귀 임박   국정감사 격돌 예고,Politics
사법부 양대 수장 공백 우려    또 입법폭거 배제못해  종합 ,Politics
채완병 이스라엘 한인회장  교민 피해 없어 위험 지역 공유 ,Politics
 여랑야랑 윤심  명심 지우기   혁신의 시작 ,Politics
 뉴스야     단독  낙하산 인사의 엉터리 자소서 ,Politics
 국힘의 포털 공격  중국 공산독재 떠오른단 소리 나온다   이영광의 거침없이 묻는 인터뷰 ,Politics
 사라진 김행  도망이냐 퇴장이냐 그밤 국회    호선 무슨 일,Politics
이준석  한동훈 향해  정치하세요 험지 강서벨트 출마하길 ,Politics
홍준표  한동훈 겨냥   이재명 영장 청구  추석 밥상 민심 기대한 거 같은데 망쳐 ,Politics
안정이냐 심판이냐  총선 흔드는  이재명 리스크 공천 무당층 ,Politics
홍익표  시스템에 의해 공천 하지만  당에 도움이 안 되는 사람한테 공천못 줘 ,Politics
 리플리증후군 과 거짓말의 대가들  김태경의 시선 ,Politics
부산 사수 외치던 하태경 끝내  서울행 ,Politics
홍익표  가결표 징계  총선 승리에 도움이 될지로 판단 ,Politics
여야 잠룡 운명에도 영향  대선 전초전  시선집중,Politics
쇄신론 신호탄   해운대  선    하태경  서울 출마 선언,Politics
쇄신론 신호탄   해운대  선    하태경  서울 출마 선언,Politics
 총선    개월  여 야 무당층 동률  지지율  재판 향배 가를 듯,Politics
하태경  서울 출마  선언  당내 도미노효과 부를까,Politics
홍익표  체포안 가결파 징계에  총선 승리 도움 기준으로 판단 ,Politics
 정권심판론  대  야당심판론  맞붙은 강서구청장 보궐선거,Politics
부산  선 하태경 서울로 중진 용퇴 험지 차출  새판짜기  신호탄,Politics
 김행 인사청문회 파행  여파      임명 강행할까 ,Politics
 줄행랑에 코인 보유 의혹 논란 여전  민주당  김행 지명 철회 거듭 촉구,Politics
 부산  선  하태경이 촉발한 험지출마론    중진 지도부 압박 세질까,Politics
   하태경 서울출마 평가절하    속내는  우리도 누군가 나서야 ,Politics
 수도권 차출로 이어질라     하태경 서울 출마에 국민의힘 중진들  술렁 ,Politics
문민 국방장관은  능지처참 김정은  외치는 백골 사단장이 아니다,Politics
김행만 남았다  대통령실  임명  정면돌파할 듯,Politics
김태우  범죄 피의자가 무슨 낯짝으로     사면 받으니 눈에 뵈는 게 없나 ,Politics
 노쇼  김행 임명할 듯 윤 대통령  청문보고서 패싱    번,Politics
김기현  강서구청장 보선 사전투표율  강서 발전 열망 보여준 것 ,Politics
홍익표  당에 도움 안 되는 사람에게 총선 공천 못 줘 ,Politics
 개딸 들이 가만 있을까  홍익표  가결표 던진 의원들 법적 심판  고심 ,Politics
홍익표  강서구청장 투표율     안팎일 듯 정권 심판론 때문 ,Politics
 비정규직 제로 의 역설  정부 비정규직 사상 최대치,Politics
하태경 먼저 손들었다  중진 험지차출 바람 부나,Politics
하태경이 불 지핀   험지출마론 텃밭 중진들 이어받을까,Politics
 김선수 대행 만들기      후보 자질 문제  이균용 부결 후폭풍,Politics
해병대 예비역 단체  임성근 사단장  해병대답게 퇴진하라 ,Politics
여야  역대급 강서구청장 사전투표율 두고 서로  심판 의지  종합 ,Politics
강서 보궐선거 사전투표율        여야   지지층 결집  아전인수,Politics
여당  강서구청장 보선 투표율에  재개발 열망 반영한 것  종합 ,Politics
   신원식 유인촌 이어  청문회 엑시트  김행 임명 강행 무게,Politics
홍익표  체포안 가결파 징계에  법적 심판보다 정치적 해법 있어 ,Politics
안철수  수도권 리더  큰 그림 그리나   연일 김태우 지원사격,Politics
아파도 건강보험 혜택 못 받는  수원 세모녀  전국에  만명 더 있다,Politics
부산  선 하태경  서울 출마    지역 중진  험지 출마  불 지피나,Politics
국힘 하태경의 서울   비명계 공천학살 오나   가 더 뒤숭숭,Politics
하태경발 험지 출마 압박 본격화되나 중진육성론 반박도,Politics
잇단 장관 인사에 여야 강대강 대치 윤 대통령  김행 임명할까 종합 ,Politics
    정찰위성   차 도발 예고   당 창건일 전후 쏠까,Politics
 후보자 런   습관성 비토   인선 검증 표결  단계 모두  수준미달 ,Politics
  일각선  다음 여론조작 의혹  침소봉대 비판론 제기,Politics
 뉴스        강서 보궐  역대급 사전투표율 여야 모두  승리 자신 ,Politics
민주   줄행랑 의혹 백화점  김행 후보 지명 철회해야 ,Politics
신원식 유인촌 장관 임명  김행은  국회 절차 끝내야     철회하라 ,Politics
 이 팔 전쟁  이번엔  이스라엘 전쟁  대외정책 암초 대선 앞 바이든 시험대,Politics
  정부 심판    보수표 결집  강서 역대급 사전투표에 여야  아전인수 ,Politics
   김행 후보자 지명 당장 철회해야 ,Politics
박용진  새누리당   진박  감별하다 패배    수박 감별기  논란 뭐길래,Politics
 단독   체포안 가결 에 물러난 박광온 원내지도부   주 만에 비공개 만찬,Politics
복귀 초읽기  이재명 앞에 놓인 과제들,Politics
 단독   싫으면 나가라  쿠팡 대리점  일방적 택배 수수료 인상,Politics
 두만강역에 궤도차 무려   량  역대급 규모에 무기거래 본격화 예고,Politics
    의혹 백화점  김행 후보자 지명 당장 철회해야 ,Politics
강서구청장 보선 사전투표 신기록     이재명 승리  외치는 민주당 심판 열기 ,Politics
윤 대통령  김행도 임명 강행하나,Politics
한국을  괴뢰 로 호칭    북한 매체서  남조선  사라졌다,Politics
 김행만 남았다  대통령실  임명으로  정면돌파 할 듯,Politics
민주  김행 지명 철회 촉구  줄행랑에   억 코인 보유 논란까지  의혹 백화점  ,Politics
한국  괴뢰 로 부른   남조선 호칭 사라졌다,Politics
김영우 이용호  하태경 격렬히 응원  텃밭떠나 서울로  험지출마 동기 되나,Politics
 이재명 체포 찬성한  인 징계하라     만명 압박에 반발도 만만치 않네,Politics
신원식 국방부 장관 취임 일성은  첫째  둘째  셋째도 응징 ,Politics
정부    년째 억류된 선교사 돌려보내라  한국인  명 붙잡아둔  ,Politics
 빽다방  알바생 찾습니다  보훈부 장관도 직접 나선 이유,Politics
유승민  윤 대통령   친구의 친구 만 찾지 말아야 ,Politics
김태우   역대 최고  사전투표율에  양 진영 지지층 결집 조직력 안 밀려 ,Politics
이균용 부결  신원식 유인촌 임명  김행은 파행 강대강 대치 지속,Politics
 빚이 복사가 되네   킹달러 에 달러대출 연중최저,Politics
강서구청장 사전투표 역대급 흥행에 여야 각각  윤석열 이재명 심판 ,Politics
 수원 세모녀  아직 곳곳에 있다  만원이하 건보료 체납자   만세대,Politics
민주   이재명 피의자 발언  김태우에  윤 사면 받으니 눈에 보이는 것 없나 ,Politics
 보복 기소      항명 혐의  해병대  수사단장 법정구속 되나  이현호 기자의 밀리터리 톡 ,Politics
홍준표  이재명 영장 기각해줬는데 은혜도 몰라    겨냥,Politics
 복귀 임박  이재명 체포동의안 가결파 내칠까  안을까,Politics
민주  범죄자 김태우  야당 대표에 막말 눈에 보이는 것이 없나 ,Politics
민주당  범죄자 김태우  야당 대표에 막말 퍼붓는 행태 뻔뻔 ,Politics
 보수 결집    정부 심판  강서 최고 사전투표율에  아전인수 ,Politics
한동훈 국힘 싱크로율 무엇   이균용 부결   민주당의 이재명 방탄 ,Politics
 정치 파일  년마다 공직자 줄사퇴  작별의  월 엔 어떤 사연이,Politics
강서구청장 보선 사전투표  열기  여  보수 지지층 결집  야  정권심판 민심 결집 ,Politics
하태경이 쏘아올린 중진 차출론  년 전 자객공천 아픔 씻어낼까,Politics
오늘 김정욱씨 북한억류   년 정부  하루빨리 가족 품으로 ,Politics
민주당  검찰  이재명 범죄자로 만들겠다는 욕심 못버려 ,Politics
  회       회   이재명 압수수색  횟수 왜 다른가,Politics
이원욱   개딸 에  모택통 홍위병과 뭐가 다른가 이재명에 민주주의 묻는다 ,Politics
유승민  대통령이  친구의 친구 만 찾지 말고  반듯한  후보 찾으라 ,Politics
이재명도 김기현도 잠 못드는  강서구의 밤 ,Politics
 이재명 인천 계양행 에 안철수 소회    이길 자신 있었는데 ,Politics
서울 강서구청장 사전투표율          누구에게 유리 ,Politics
하태경이 포문 연  중진 수도권 차출   여야 중진들 등 떠밀까,Politics
 부산  선  하태경 서울 출마 선언에  에선 응원  는 경보음,Politics
소형 자폭드론  배회탄약 으로 우크라이나 허 찌른 러시아,Politics
   수박 감별기 에 친명 정성호  나도    검사 탄핵 동의 안 해서 ,Politics
  에 돈  거꾸로 피 흐르냐  아베  위안부 합의후 호되게 당했다,Politics
 여의도풍향계    대 총선  개월 앞으로 명운 건 여야,Politics
김두관  하태경 서울출마에  민주당도 혁신경쟁 뒤져서 안된다 ,Politics
 공천 물갈이 는 총선 승리 공식     대 총선 전망은  심층기획      대 총선으로 본  공천 정치학  ,Politics
대통령을 이렇게도 뽑았다고  한국 보궐선거의 역사  대통령의 연설 ,Politics
통일전망대에 문재인 대통령 휘호만 없는 이유는,Politics
김행에 묻힌 유인촌 청문회  경험자의 노하우 ,Politics
김두관  하태경 봐라    변화  색출 고름 친명 비명  갈라치기할 때 아냐 ,Politics
하태경 수도권 출마가 불러올 나비효과 ,Politics
정몽규 최정우 박철희 등 기업인  대거 국감 증인 소환 갑질 중대재해 의혹 추궁,Politics
조승현  정치인들  입만 열면  서민의 편  탐욕 버려야 신뢰 회복    류 정치 청산   연속 인터뷰 ,Politics
 때려잡자 김정은  외치는  쌈닭  신원식과 문민정부 국방장관 김관용의      ,Politics
대통령은 통치자 아닌 정치인 이젠 이재명 만나야 한다,Politics
수년간 지구 돌다  불시 타격  러시아 핵추진 순항미사일 진짜였다  이현호 기자의 밀리터리 톡 ,Politics
시가행진 나온  고위력 현무      과 핵억제의 톱니바퀴 안보열전 ,Politics
불복의 계절  몸값정치 민생 능멸하는 대리인 딜레마 한기호의 정치박박 ,Politics
 우리도 나간다    소속 지자체 인사들 총선 출마  잰걸음 ,Politics
이재명   당무 복귀  가능성  강서 보선 내분 봉합에 대여 전략까지 과제,Politics
정치 사회 현안  소신 밝히는 연예인들 비판과 응원 사이,Politics
 남조선  대신  괴뢰  북한 매체가  한국 을 부르는 새 방식,Politics
총선  개월 앞둔 중대한 사안     중국 응원 클릭 에  드루킹 시즌   ,Politics
윤 대통령  직접 나서 교사 숙원  수당  인상 교사 달래기,Politics
백낙청은 왜 이재명을  김대중 이후 최고 정치인 으로 띄우고 있나  송의달      ,Politics
 대만을 포위하라  압박 높이는    전략무기로 맞서는 대만  박수찬의   ,Politics
당무 복귀 임박 이재명  가결파 축출론  입장 밝힐까,Politics
  청년유감  이동학  이재명 은 수사권 보복의 전형적 사례다,Politics
규탄성명  남발  하더니  차 방류 땐  조용  야당의 힘빠진   오염수  선동 ,Politics
 정치권 말말말  김기현  이재명  내가 겁나나  홍익표  부적격 대법원장 다 거부 ,Politics
 러시아서 위성 발사  무산   혈세    억 증발 위기,Politics
 총선  개월   캐스팅보트  충청 민심 싸늘  민생 개혁이 선택영향 ,Politics
