titles,category
 총선  개월  호남 민심  민주당 마음에 안들어도 국민의힘이 대안  글쎄 ,Politics
 총선  개월   승부처  수도권 민심 예측불허  민생 대안이 승부 관건 ,Politics
 총선  개월   보수 강세  영남권   우위 관측 속  견제론 도 솔솔,Politics
연휴 뒤 국정감사 돌입   전 현 정권 실정 부각 격돌,Politics
두드리는 이재명 대답 없는     영수회담은  요원 ,Politics
하태경  내년 총선서 제 고향 해운대 떠나 서울서 도전 ,Politics
 수억대 코인 보유  김행 국민의힘은 이미 알고 있었다,Politics
하태경 내년 총선 수도권 험지 출마  국힘 중진들 가세할까,Politics
 살아있는 한 계속할 것  대장동 재판 출석 이재명  검찰은  백현동  카드 만지작,Politics
 지지율  명절 후    대로  고물가 등 경제상황 영향 ,Politics
정치  년  당적만  번 바꾼다 논란의 조정훈 영입하는    왜,Politics
호주   명 숨진 끔찍 추락  조별과제의 저주  그 헬기 결국  이철재의 밀담 ,Politics
조민  어린 시절 사진 공개  성형  한 곳도 안 했다 ,Politics
 이거야       북한이 조용필을 콕 집어 평양에 초대한 이유  ,Politics
포털을 통한 여론조작 의혹  과연 어디까지 봐야 할까 ,Politics
 팩트체크   효도백신  종세트   정말 효도 선물일까 ,Politics
사전투표율          지방선거 재보선 통틀어 최고치,Politics
김태우  이재명 유세 취소에  범죄 피의자가 뭔 낯짝으로 나서겠나 ,Politics
대법원장 임명안  부결  김행 청문회 파행   여야  정쟁 격화,Politics
 당원도 아닌데  송영길 강서구 출몰에 민주당 속앓이,Politics
강서 보궐  역대급 사전투표율 여야 모두  승리 자신 ,Politics
강서구청장 보궐선거 사전투표율          여야 유불리 촉각,Politics
 유세 지원 취소에 김태우  중대범죄 피의자 무슨 낯짝으로 나서겠나 ,Politics
  월 정찰위성 발사 예고한      차 발사 임박,Politics
이재명  국회 본관에 드디어 모습 드러내 민주 의원들 환대,Politics
신원식 신임 국방장관    도발시 즉각  강력히  끝까지 응징 ,Politics
김태우  이재명 겨냥  중대범죄 피의자 유세 자격 없어 ,Politics
    청문 보고서 불발  신원식 임명 강행   유인촌도 임명,Politics
사전투표율          지방선거 재보선 통틀어 최고치,Politics
 앗 뜨거   이 판 키운 선거         보선 사전투표율 기록 갈아치웠다,Politics
신원식 국방  임란 때 전라좌수영 장졸처럼   도발 시 즉각 강력히 끝까지 응징 ,Politics
박용진  수박 감별리스트에   진박  감별하다 폭망한 새누리 떠올라 ,Politics
   억 애교  논란에 김태우  당선되면 급여 단  원도 안 받을 것 ,Politics
 이재명  범죄 피의자기 때문  김태우  이재명 유세 취소에 일갈,Politics
사전투표율          지방선거 재보선 통틀어 최고치,Politics
신원식 신임 국방장관  북 도발시 즉각  강력히  끝까지 응징  종합 보 ,Politics
여야  사전투표 마지막 날 강서구 찾아  집중유세  역대 최고 투표 열기 종합 ,Politics
 역대 최고  찍은 강서구청장 사전투표율 야  정권심판론  기대감,Politics
 비윤  하태경  총선  서울 출마   친윤  다선은 ,Politics
 정치톡톡  사전투표율 누가 유리    김행 청문회 파행 네 탓 공방   하태경  험지출마 첫 선언,Politics
강서구청장 선거  재보궐선거  최고 사전투표율  기록  여야  누가 웃나,Politics
 여랑야랑 줄을 서시오     번째 임명 강행,Politics
강서구청장 사전투표율        지선 재보선 통틀어 역대 최고 종합 ,Politics
국민의힘  사전투표 마지막 날도 강서로  김태우 약속 보증 ,Politics
 막말  의령군의회  공무원노조와 갈등  개월 만에 합의,Politics
 아는기자  강서구청장 재보궐선거  높은 사전투표율  어느 당에 유리 ,Politics
여권  부산  선  하태경 서울 출마에  영원히 사는 길 결정 환영 ,Politics
  중진의 서울 출마 선언 험지 출마론 탄력  미풍 ,Politics
 뉴스야     단독  가짜뉴스로 바뀐 대장동 몸통 ,Politics
  층 줄이 투표소 마당까지  쏟아져나온 주민들에 정치권 초긴장,Politics
    구구절절 면피성 뿐   부동산 정책 실책  발언에    핑계 일색 ,Politics
 데일리안 오늘뉴스 종합  윤석열  이재명의 영수회담 응하지 않는 결정적인 이유   정책실장이 독자적으로 조작 지시 이유 없어 문재인 수사 불가피   법조계에 물어보니      등,Politics
무슨 일  박민식 장관  육군 병장 응원한  알바생 찾습니다  이현호 기자의 밀리터리 톡 ,Politics
신원식  북 도발시 즉각  강력히  끝까지 응징  국방장관 취임 종합 보 ,Politics
신원식     집권    년차에 대형 도발 즉각 강력히 끝까지 응징 ,Politics
유인촌 장관 현충원 참배  문화로 국민께 희망을  포착 ,Politics
문재인  사상 초유 부동산 상황에 실책 신뢰 잃어 뼈아프다 ,Politics
사전투표 마지막날 여야  강서구청장 지원유세 총력전,Politics
임명된 신임 신원식 국방부 유인촌 문체부 장관 뉴시스    ,Politics
 진박 감별사 사태 떠올라  민주당 강성지지층  수박 당도 명단 에 의원들 반발,Politics
 진교훈 승리하면 이재명도 이겨    정권심판  앞세운 민주당,Politics
건건이 충돌하는 여야 정국 살얼음판,Politics
여권   부산  선  하태경 서울 출마 선언에  용기 박수 같이 가자 ,Politics
 뉴스       취임 첫 일정으로 현충원 찾은 유인촌 신원식,Politics
윤 대통령  신원식 유인촌 임명  기어코 고집부리는 오만과 불통 기막혀 ,Politics
유인촌  문화로 희망과 위로를  장관 임명 후 현충원 참배,Politics
민주  강서구 찾아  진교훈 집중유세  지도부 의원 대거 지원사격,Politics
신원식 신임 국방장관  적의 악의를 전제로 대비 도발에 끝까지 응징 ,Politics
조민  엄마가 찾아준 사진  어린 시절 소환해  성형 의혹 부인 ,Politics
국힘 민주  사전투표 마지막날 강서구청장 유세 총력전,Politics
윤석열 대통령  신원식 국방장관 유인촌 문화장관 임명,Politics
     사전투표 마지막날  강서구청장 보궐 유세 총력전,Politics
전북 출신 이용호  하태경 서울 출마 선언 환영 같이 가자 ,Politics
홍익표  부적격자 대법원장 또 보내면 다 부결시킬 것 ,Politics
이언주  김행  어디 국민 앞에서 박차고 나가나 본인이 사퇴 의사 표시한 것 ,Politics
문재인  문 정부 부동산 정책 실책 있어 신뢰 잃어 뼈아파 ,Politics
강서구청장 보궐선거 사전투표  일차 오후  시 투표율       ,Politics
 기회주의자   뻐꾸기 정치인   국힘 입당  조정훈 뭇매,Politics
신원식 장관  응징이 억제이고  억제가 곧 평화  대적관 강조하기도,Politics
신원식 신임 국방장관    도발하면 즉각 응징 ,Politics
문재인  부동산 정책  초유 상황에 실책 신뢰 잃어 뼈아프다 ,Politics
     년  월까지는 부동산 선방했는데   신뢰 잃었던 것이 뼈아파 ,Politics
육군 병장 감동시킨 카페 직원 박민식  제일 큰 표창 주고파 ,Politics
    청문 보고서 불발  신원식 임명 강행   유인촌도 임명,Politics
   강서구청장 보선 유세 급취소    민주당이 대표 손절 ,Politics
홍익표  대법원장  부적격자로 제  제  보내면 다 거부 제대로 보내라 ,Politics
박민식  육군병장 응원 카페 알바생  따뜻한 밥 먹으며 제일 큰 표창 주고파 ,Politics
신원식 유인촌 장관 임명에 여  국정 적임자  야  싸우자 개각 ,Politics
문 전 대통령  부동산 정책 신뢰 상실  뼈아픈 실책 ,Politics
   신원식 유인촌 임명에  오만 불통   싸우자 개각  맹비난,Politics
신원식 국방부 장관  선의로 북한 바꿀 수 있단 믿음은 환상 ,Politics
여당  문재인  실패한 정책에 핑계 일색 무게감 없어 ,Politics
여당 영남 중진  윤 참모 경쟁 험지 출마론에  노심초사 ,Politics
문재인  부동산 정책  실책 있었다 정책 신뢰 잃었던 것  뼈아파 ,Politics
문재인  부동산 정책 실기 있었다 신뢰 잃은 거 뼈 아파 ,Politics
   억 애교  김태우  당선되면  원짜리도 개인이 가져가지 않을 것 ,Politics
하태경  내년 총선 서울 출마  영남권 중진  수도권행  신호탄 ,Politics
   서이초 사건  더 인내했다면  발언에    파렴치 뻔뻔 ,Politics
 대통령비서실 직원 명단 공개하라    국민의 알 권리 손 들어준 법원,Politics
   이재명 방탄  국민보다 우선시     사법완박  비난,Politics
육사교장 출신들  홍범도 흉상    지시  아니라는 김완태   교장  꼬리자르기 월권  ,Politics
   부동산 정책 신뢰 잃은 것 뼈아파  국힘  가벼운 화법 또 등장 ,Politics
하태경 서울 출마 선언  국힘 보수텃밭 중진의원 수도권 험지 차출  신호탄  강원은 ,Politics
앞에선  긴축재정  한목소리 뒤에선 식사비   억  펑펑  대통령 직속기구,Politics
신원식 국방장관 임명  홍범도에 수여된  육사 명예졸업장  재검토하나,Politics
홍준표  대법원장 부결에  민주  이재명 기각해줬는데 배은망덕 ,Politics
조민  왜 성형했다고 생각하지     어린시절 사진 공개,Politics
야권  신원식 유인촌 장관 임명에  인사 참사   싸우자 개각 ,Politics
신원식 유인촌 임명에   국정철학 적임자   오만 불통 기막혀 ,Politics
   신원식 국방부 장관 임명 강행   유인촌도 임명 재가,Politics
 제대로 할 사람 뽑을 것     주말 맞아 달아오른 사전투표 열기,Politics
하태경  내년 총선서 서울 지역 출마 선언  마포을 가능성 종합 ,Politics
잠시  국회 등원  이재명  여의도 복귀 후 과제  산적 ,Politics
정책 실패로 집값  배 넘게 뛰었는데     세계적 급등 속 선방 ,Politics
윤 대통령  신원식 유인촌 장관 임명 재가  김행은 언제쯤 종합 ,Politics
 자랑스러운 군대 만들라   물러나는 이종섭 장관의 마지막 당부는  박수찬의   ,Politics
하태경  부산 대신 서울 출마  수도권 승리 밀알 되겠다 ,Politics
이재명  강서구 지원유세  안하기로  회복치료 계속 ,Politics
부산  선 하태경  서울 출마 선언 중진 험지 출마론 재부상  주목 ,Politics
 부산  선  하태경  기득권 내려놓는다  내년 총선 서울 출마 선언,Politics
   신원식 국방 유인촌 문화체육관광 장관 임명 김행 여가장관 후보자도 임명할 듯,Politics
감사원   전현희 감사  주심 조은석 위원에  경고조치  당분간 주심 배제,Politics
강서구청장 보선 유세 예고한 이재명  일정  시간 전 취소,Politics
 해운대  선  하태경  서울 출마 선언 중진 험지 출마 신호탄 될까,Politics
강서구청장 보궐 사전투표 직접 가보니      대 북적,Politics
이재명  강서 보선 지원유세 돌연 취소  회복 치료 이어갈 것 ,Politics
 현장에서  사전투표  예상 밖  열기  일꾼론    견제론  엇갈린 강서,Politics
   신원식 유인촌 임명   여야 강대강 대치 불가피,Politics
 선 하태경  내년 총선서 기득권 내려놓고 서울 출마할 것 ,Politics
 정치적 기득권 내려놓겠다  하태경  내년 총선 서울 출마 선언 종합 ,Politics
박대출  이균용 임명안 부결에  이재명 방탄 위한  사법완박 인가 ,Politics
이재명  병원 외출 강서구청장 보선 유세 지원 돌연 취소,Politics
이균용 임명동의안 부결   년 만의 낙마,Politics
   잠수함서 핵미사일    발     기괴하게 개조    녹취록 ,Politics
 부산  선  하태경  내년 총선 서울 출마  기득권 내려놓을 것  종합 ,Politics
  떠나는 이종섭  전투형 강군 건설 매진해 달라   인터뷰 ,Politics
   이균용 임명안 부결에  이재명 방탄을 국민보다 우선시 ,Politics
 해운대  선    하태경  영남 중진  수도권 험지 출마  불씨 될까,Politics
 엑시트  전문가 김행의  가지 장면 장관 후보 엑시트는 ,Politics
   신원식 국방부 장관 유인촌 문체부 장관 임명,Politics
   신원식 국방부 장관 임명 강행   유인촌도 임명 재가,Politics
하태경  내년 총선 험지 출마 선언  해운대 대신 서울로,Politics
홍준표  이재명 영장 기각해 줬는데 민주당 배은망덕 ,Politics
민주  신원식  문 지시로 홍범도 흉상 설치  주장에  대국민 허위보고 ,Politics
 북  러시아에 대포 이전 시작    정상회담 후속 조치 ,Politics
하태경  내년 총선  부산 해운대갑 아닌 서울서 도전 ,Politics
 부산  선  국민의힘 하태경  내년 총선서 서울 출마 선언,Politics
 속보  국민의힘 하태경  서울 출마 선언   정청래와 맞붙나,Politics
   선제타격 해야     서 나온 발언   녹취록 ,Politics
 자막뉴스  결전 앞둔 러시아에    이 넘기는 무기의  실체 ,Politics
이언주  청문회 중 나간 김행  어디 감히 본인이 사퇴 의사 표시한 것 ,Politics
  두만강역에 궤도차 역대최다   량 러에 무기 공급 가능성 ,Politics
신평  민주당 새 얼굴  이낙연 아닌 김부겸 이탄희 ,Politics
여당  이균용 임명안 부결  민주당의 사법부 길들이기 ,Politics
홍준표  이재명 영장 기각해줬는데 배은망덕  대법원장 부결 비판,Politics
북  인민의 가난 방치하지만 경제적 양극화는  먼 일 ,Politics
신평  김행  이해할수 없는 행동   정부 인사만 인선  이해 어려워 ,Politics
수도권 지하철 요금 오늘부터     원   재승차하면   분까지 무료,Politics
 수박  지목된 이원욱  이재명 대표에게 민주주의를 묻는다 ,Politics
북한  대러 무기 공급 본격화됐나      두만강역에 궤도차 역대최다   량,Politics
대통령실  새 대법원장 후보자 인선 돌입 조희대 홍승면 강민구 거론,Politics
이균용 임명동의안 부결     년 만에 대법원장 낙마,Politics
이재명  오늘  강서구 지원유세  오후  마곡나루역  예정,Politics
  두만강역에 궤도차 역대최다   량 대러 무기공급 가능성  종합 ,Politics
반기문  개 식용 비판 편지 수두룩  국제적 수치   이낙연  반려동물 물건 아닌 생명 존중 ,Politics
초유의 사태에 공방만 가열  드라마틱 엑시트   편파 진행 ,Politics
 년간 우체국 소포 분실 파손  만 천건   배상금   억 국고서 나갔다,Politics
잠시  국회 등원  이재명  여의도 복귀 후 과제  산적 ,Politics
민주    계 김행랑    청문회 도중 사라진 여가부 장관 후보   녹취록 ,Politics
여의도 불꽃축제에    만 인파 몰린다   일대 교통통제,Politics
 논썰  부결된 대법원장  도망간 김행  정권 수준  드러낸 인사 참사,Politics
사상 최초  청문회 중 퇴장  엑시트 김행  법적 문제 없나  이슈픽 ,Politics
 북한 억류   년  김정욱 생사도 몰라  국내외 관심 절실 ,Politics
 산불보다 관광 끊겨 더 힘들어  유선희 하와이마우이한인회장,Politics
 정치 그날엔      정기승 대법원장 부결 정말  치명적 실수  때문 ,Politics
탕후루 대표와 마약 아이돌까지 국정감사  이색 증인  열풍,Politics
상위    가수 연간   억원 운동선수  억원 번다,Politics
전 육사 교장  홍범도 흉상   의지  신원식 주장  사실 아니다 ,Politics
범죄 소명 부족으로 영장 기각 검찰  이재명 영장 재청구 어려울 듯,Politics
금태섭  내년 총선 국민의힘 민주당 바깥에서   석 만들 복안 있다 ,Politics
이재명 영장 기각에도 대화조차 없는 정치   민생은 언제 챙길까,Politics
강서보선  명함 배포  고발전,Politics
 수박  지목 이원욱  이재명 대표에게 민주주의를 묻는다 ,Politics
중국 주재 북한 옥류관  한국인 절대 받지 마라 ,Politics
   서울이든 제주든 비행학생 처벌기준 동일해야 ,Politics
 요즘 북한은  여유로운 국제 노인절 팍팍한 노후 외,Politics
여야 극단 정치가 부른 사법 공백  정치 후진화 에 가슴 치는 국민,Politics
 도대체 몇 년째 수사냐  이재명  대장동 첫 재판서   작심 비판,Politics
이균용 임명안 부결  혼란에 빠진 사법부 전합선고 지연 어쩌나,Politics
 뉴스 즉설 후쿠시마 오염수  차 방류에도 조용한 민주당 왜 ,Politics
이준석  한동훈  총선 뛰어들 수밖에 없다   영등포 양천 강서 가라 ,Politics
김태우   당선되면 급여 단  원도 안 받을 것 ,Politics
 단독   긴축재정  외치며 잘 먹고 다닌 대통령 직속위 식사비만   억,Politics
마약소굴이라더니 불법체류자만 외국인 밀집지 허위신고 잇따라,Politics
카카오 선물하기       환불  광고하더니  년간 수수료     억,Politics
여가부의 두번째 숨바꼭질 한방 없던 민주 기자의눈 ,Politics
장예찬  경고한다   의원들 인터뷰 적극 응하라 이준석  유치해 아쉽다 ,Politics
 새누리도  진박  감별하다 폭망   수박 당도 에 비명계  펄쩍 ,Politics
 핵무력  헌법 명시 북한의 속내와 파장,Politics
   학폭 심하면 경찰이 담당  비행학생 처벌기준 동일해야 ,Politics
이상민  조응천과 이상민은 달라  갈라치기 기분 더럽다   한판승부 ,Politics
이언주  국민면접 도중 퇴장한 김행  스스로 때려치운 것   한판승부 ,Politics
북한의 개천절 단군릉 앞 김정은 찬양,Politics
정치권 달군  포털 응원  논란  네티즌이 장난한 거라고    이슈  ,Politics
 비정규직 제로화 한다더니    정부 비정규직 비중  사상 최대 ,Politics
끝내 돌아오지 않은 김행 사상 초유  엑시트 로 끝난 청문회,Politics
    도 군대 갔는데  게이머가 안 가   병역특례에  갑론을박   이슈  ,Politics
신평     국힘 민주 자유세력과 정개개편 이준석 나가고 조국은 출마 ,Politics
 김행  드라마틱하게 청문회 엑시트   위원장 사퇴하라 ,Politics
전세 사기    영어유치원 막 오른 강서구청장 보궐  공약 대결 ,Politics
여야  사법수장 공백 에 네 탓만 이균용 부결 후폭풍  이런정치 ,Politics
이균용 인준 부결   년 만에 대법원장 낙마,Politics
이재명 기사회생하자 당까지 강공모드 통합 문제없나,Politics
 윤석열 정권  학점  성직자들이 대통령에게 남긴 메시지는 ,Politics
이번주 국회에는 무슨 일이   뉴시스국회토    ,Politics
본선같은 예선  경북  현역 신인 각축 속 전략공천 변수,Politics
이준석은  와 밀당 중  김태우 지원 요청에  관심없다 ,Politics
여당 프리미엄 반이재명 강서구청장 선거서 통할까 여의도속풀이 ,Politics
  호 커플 자리 비어  용산어린이정원 개장 반년  몰랐던 꿀팁은,Politics
 홍범도 흉상 설치  육사 내부서 수십 차례 토의 누구 지시 받지 않아 ,Politics
 항명 혐의  해병대 전 수사단장 기소  무리한 기소 ,Politics
  정찰위성  차 발사 임박      효력정지 도화선 되나,Politics
이재명  검사 수십명 투입해 수백번 압수수색  살아있는 한 계속될 것 ,Politics
 육사교장  홍범도 흉상  지시 없었다  신원식    지시  반박,Politics
민주   줄행랑  김행   자격미달  유인촌 ,Politics
 심판이 변호인 역할    감사원  전현희 감사 재심의,Politics
여당 지도부  강서구청장 사전투표 마지막날 현장 집중유세,Politics
여의도  수박감별   극우 유튜버    매카시 해임 광풍 보인다,Politics
이준석  한동훈  결국 정치 뛰어들 수 밖에 없을 것 ,Politics
 김행불   김행랑  파행 정국 임명강행이  드라마틱 엑시트  ,Politics
통합이냐  청산이냐 이재명 침묵의 의미는   다음주의 질문 ,Politics
이재명 구속 기각의 나비효과  김건희 대장동  쌍특검 이 기다린다 박세열 칼럼 ,Politics
 총선 전초전  강서구청장 보선   패자는 타격 불가피,Politics
신평  윤 대통령  민주 국힘 규합한  정계 개편  유혹받는 듯 ,Politics
사전투표 독려 이재명  주말 강서구청장 선거 지원 유세 나서나,Politics
   성과까지 싹 지워졌다  용산 출마러시 뒤엔  공천학살 기억 ,Politics
예고된 북한  위성   차 도발  구체적 시점은,Politics
남북 통신선  불통  반년    월 한반도 정세도  예측 불허 ,Politics
 정치 실종 이 초래한  사법 공백     년 만에 대법원장 동의 부결,Politics
이균용 결국 낙마    년만 사법 공백,Politics
   담임 수당      보직 수당  배 이상 인상 ,Politics
 이 임명한 감사위원들도   정부가 공무원 월북몰이 ,Politics
중공군에 처음 이긴 곳   몽클라르의 길  조성,Politics
조희대 홍승면 강민구 새 후보 거론  지명 청문회까지 두달,Politics
청문회 도중 나가버린 김행  사상 초유  후보 퇴장 ,Politics
   청문회중 퇴장한 김행 사퇴를       의 편파진행 문제 ,Politics
   채상병 특검 패스트트랙  지정 강행  이재명  택시 타고 본회의 참석해 투표,Politics
대통령실  대법원장 원점서 재검토   헌재소장은 이종석 유력,Politics
대법원장 임명안 부결   최소 두달 이상 공백 ,Politics
민주    대 총선때보다 분위기 좋아  국힘  바닥 민심 돌아와 ,Politics
대법원장 권한대행 체제  법관 인사 전원합의체 올스톱,Politics
민주  부결 당론 채택해 이탈표 단속 국힘  사법공백 야기 사죄하라 ,Politics
이 대표  정진상 안아보게 해달라  법정서 끌어안고 악수,Politics
   폭주로 끝내 사법 공백 발생     정부 국정 발목 잡아   종합 ,Politics
최재성   주식 파킹  이어  장관 파킹  김행 줄행랑은  나 장관 안 하겠다 는 것 ,Politics
조은희  김행 임명될 것 청문회  한 방  없었다 ,Politics
 단독포착  민주당 의원톡방에 공유된  김행방불명 ,Politics
 주간   상   김행 청문회 도중 이례적  퇴장   별명이 생겼다고  ,Politics
 주간   하   수박 당도 높으면 아웃  민주당  비명  낙인찍기,Politics
강서구청장 보궐선거 여야 후보 모두 사전투표 지지층 결집 총력,Politics
  육사 교장  홍범도 흉상   의지  신원식 주장  사실 아니다 ,Politics
군검찰  해병  수사단장 불구속 기소       특검법 패스트트랙 지정,Politics
사전투표 첫날 투표율         지지층 결집  총력 ,Politics
 이재명  법카 유용  정황 알았을 것  권익위  검찰에 이첩,Politics
 나이트포커스  이재명   대장동 위례  의혹 첫 재판 출석    정진상 안아보고 싶다  요청,Politics
박 대령 측  군 검찰의 무리한 기소  결국 국방부 발목 잡을 것 ,Politics
교사들 만난    교권은 선생님들의 권리가 아니라 학생의 권리 ,Politics
 이균용 임명동의안  부결 배경은 이재명 재판 지연 전략 담겼나,Politics
홍준표  대법원장 부결  이재명 구속 기각 은혜도 모르고 배은망덕 ,Politics
거야의 사법부 인질극 대법원장 임명  민주화후 첫 부결,Politics
김완태  육사교장  홍범도 흉상 누구 지시로 세운 것 아냐 ,Politics
이균용 부결 여  이재명 방탄 의회 테러  야  부적절 인사  윤 책임 ,Politics
 주진우 라이브  신평      민주당 내 전체주의 세력 고립 시켜 국힘과 통합  자유주의 세력으로 규합할 것 ,Politics
사전투표 첫날 투표율         지지층 결집  총력 ,Politics
이균용 임명동의안 부결     년 만에 대법원장 낙마,Politics
김재원  김태우 후보에   나는 왕의 남자 라며 뽑아 달라고 할 것 ,Politics
 단독  매크로 판매자 접촉해보니 수십만원에  무한 댓글 ,Politics
 초유의  김행랑  사태  뒤엔 여당 후보자의  청문회 무시 ,Politics
강서구청장 보궐선거 사전투표 첫날 투표율        총선 전초전 다웠다,Politics
 단독   홍범도 흉상 설치  육사 내부서 수십 차례 토의 누구 지시 받지 않아 ,Politics
이균용 직접 지명한 대통령 검증담당 법무부 인선 실패 책임자들,Politics
박정훈 대령  불구속 상태로 법정 선다,Politics
이준석  한동훈  내년 총선 뛰어드는 수밖에 ,Politics
 단독   이재명 법카  조사 권익위  주말 사용 감추려 카드 바꿔치기 ,Politics
 강서구청장 보궐선거  김태우  당선되면 급여 안받겠다 ,Politics
김행 중도 퇴장에    김행방불명     편파 운영 문제 ,Politics
대법원장 부결에 국감까지 강대강 대치 불가피,Politics
 이균용 부결 에 담긴   노림수 연말까지  극한 대치  불가피,Politics
