titles,category
이재명 사법리스크  아직      민주층      해소됐다   비명 통합은  고민 ,Politics
대통령실       효력정지 포함 모든 조치 검토  이 팔 전쟁에 속도,Politics
 자막뉴스  정청래  안민석  누구를 잡을 것인가,Politics
   막말 지적하다  이재명 쌍욕은   되치기에  난감 ,Politics
 부정선거 음모론  올라탄 국힘  선관위 뚫렸다 강서구청장 선거 수개표해야 ,Politics
국회 복지위   의대 정원 확충 오염수 보고서 비공개  맹공 종합 ,Politics
 자진사퇴냐  지명철회냐  김행 놓고 대통령실도 의견 분분,Politics
김기현  민주당 정권  선거결과 조작 위해 선관위 보안 방치  ,Politics
장경태  소셜뉴스 최대 주주는 김행 딸  김행  부당 재산 은닉 없어 ,Politics
    사장 이르면   일 임명 보궐이사에 이동욱 전 월간조선 기자,Politics
  빚나는  청춘이라는데     가계대출 대책 따져 물은 정무위,Politics
이준석     하고 자빠져  안철수 논란에  강서 지면  책임 ,Politics
 더뉴스  하마스 재래식 로켓  천 발에 아이언돔 뚫려   우리는 ,Politics
김병민   강서    차  이준석 사이비 평론가 맞다    압승 점쳤다 사색 ,Politics
하태경  험지행  비판했다 역풍맞은 홍준표 ,Politics
출근길 점심시간 투표  강서 보선 오후 시 투표율      ,Politics
 국민 표 대신 뭘 지켰나  선관위  해킹 노출  논란 일파만파,Politics
민주   줄행랑  김행  윤정부 장관 후보자다운 오만 ,Politics
홍준표 저격에 하태경  당 죽고 나만 살자 길  누가 선택했나 ,Politics
법사위 여야  전 현 정권 사안 놓고  팽팽  통계조작    인사정보단,Politics
비명계 찍어내기로 악용   중진  험지 출마론  불붙이는 친명계,Politics
 대통령  김행 임명  고심  신원식 유인촌엔 임명장  용산실록 ,Politics
 이재명 분당갑행 에  비명계  송갑석도 은근 힘 싣나  그게 맞다면 그렇게라도 해야 ,Politics
강서구청장 보선 투표율          작년 지방선거 대비       ,Politics
한국인 여행객    명 귀국  현지 공항에 사람 몰려 ,Politics
복지위 첫날   오염수  공방    질병청이 보고서 숨겨 ,Politics
 나라 안팎으로 무서워  투표소 찾은 강서구민들 바람은 르포 ,Politics
  대통령  신원식 유인촌 장관 임명장 수여 김행  임명  장고,Politics
 자막뉴스   기괴한 개조    전문가들도 놀란   핵잠수함 보니,Politics
정청래     정상외교에    억 본인 돈이면 이렇게 쓰겠나 ,Politics
천하람  윤핵관 서울 올라와야 제일 좋은 분은 장제원 ,Politics
 단독      일 밤 탈북민    여명 북송   군사작전 하듯  곳서 동시에,Politics
천하람  홍준표  마음에 안 들면 다 배신자  박근혜를 향단이라 해놓고 ,Politics
장경태  소셜뉴스 최대 주주는 김행 후보자 딸 ,Politics
환경부 장관    오염수 우리 영향 미미  자신 있냐  질문에  네 ,Politics
양평고속도로 노선 변경시  환경성 정책성  하락  원희룡 장관 답변은,Politics
한동훈  인사검증 문제에  성공한 사람들 대개 비슷한 문제 나오게 돼 있다 ,Politics
홍준표 저격한 하태경   당사아생  길 선택한 사람 누구였나 ,Politics
      억 원  합참 이전   감감무소식 인 이유는,Politics
 자막뉴스  한국    억 날릴 판   러시아 전쟁  불똥 ,Politics
 논란 키워 말아   선관위 해킹 가능  발표에  주판알  튕기는  ,Politics
 질병청  원전수 보고서 숨기곤 말도 안 되는 소리만 늘어놔  질타,Politics
 뉴스초점  강서구청장 보궐선거 국회선 이틀째 국정감사,Politics
김영호       군사합의  정찰자산 운용 과도하게 막아 ,Politics
여  박범계 출장비 축소 의혹  제기 박  축소 이유 없어  국감초점 ,Politics
 민병덕  대출 부당 가산금리  왜 기존 대출에선 안 빼나 ,Politics
 뉴스앤이슈  강서구청장 재보궐 선거         국민의힘 민주당 누가 웃을까 ,Politics
 년형 선고  서대문형무소에 수감,Politics
민주  모순된 정책 때문 가계부채 실패  사과해야  김주현  모순 아냐 ,Politics
송영길     번 넘는 압수수색 더는 당하지 않겠다  규탄 농성 선전포고,Politics
복지위 국감 여  문케어로 건보재정 악화     야  의대 정원 늘려야 ,Politics
교육위 국정감사에서  김건희 논문  증인 불참 논란 야  동행 명령장 발부해야 ,Politics
신원식  대화력전 전면 재검토  단시간 내 적 장사정포 궤멸시켜야 ,Politics
     개표조작 불가  선관위 헛말  민주당 대역 음모냐 선거제 바꿔야 할수도 ,Politics
한국인 여행객    명 귀국  현지 공항에 사람 몰려 ,Politics
국민의힘 시의원에  친일파 놈들아  책임져라  비판  주먹 휘두룬 시민,Politics
군 가혹행위    명 입건됐는데 실형은  명   명 중  명은 해군,Politics
박민식  정율성 기념사업 즉각 중단 안하면 시정명령 발동  종합 ,Politics
국회 교육위   김건희 논문 표절  증인 불출석에 감사 일시 중단,Politics
 자객 공천론  하태경   마포을 정청래 잡으란 얘기 많아 ,Politics
 미니총선  두 자릿수 득표차땐  여야 당 대표 둘 중 하나는  치명상 ,Politics
국힘  민주당 정권  선관위 해킹  방치 발본색원해야 ,Politics
이스라엘서 돌아온 여행객들  무사귀국 다행  교민들은 무서워서 집 밖 못 나와 ,Politics
민주당  법무부  인사정보관리단 검증 부실  한동훈  판단은 대통령실 ,Politics
강서구청장 선거    데이    여야 투표율 촉각,Politics
국방장관  대화력전 전면 재검토 단시간 내   장사정포 궤멸시켜야 ,Politics
   신원식 유인촌 임명장 수여  김행은 여전히 고심 중,Politics
오늘 강서구청장 선거 결과는 여야  심판해 달라  막판 호소,Politics
민주당  마리 앙투아네트  빵 대신 케이크 상황 오버랩    대통령 순방 예산 증가 비판,Politics
 무등의 아침  이준석  보궐선거는   정부  년 차 평가 김태우 후보 당선보다 득표율이 관심 ,Politics
진성준  강서 지면 여야 지도부 책임져야 김기현도 같은 처지 ,Politics
민주당  외국여행 좋아하는      억 기네스북감 혈세 낭비 ,Politics
 뉴스포커스  오늘 강서구청장 선거 국정감사 첫날부터 신경전,Politics
 김동연 슈퍼통장  출시 저축과 대출 한통장 해결,Politics
  장경태  소셜뉴스 최대주주는 김행 딸 부당한 재산상속 ,Politics
이원욱  이재명 험지 출마  순위 친명 다선도 솔선수범해야 ,Politics
지상전 임박   이 팔 전쟁 사망자     명 넘어,Politics
내일 총선이라면  국민의힘        민주당        박빙  메트릭스 ,Politics
 사퇴  송갑석  이재명  당이 원하면 분당 출마 안철수와 한판 붙어라 ,Politics
이준석 맹공에   김병민  사색이 됐던 것 기억해    녹취록 ,Politics
이원욱  강서 표 차이 많이 날 것 같다 페니실린 주사 격 ,Politics
민주  국민 민심 강서구에 모여 오만한 권력에 경고 보내달라 ,Politics
 선관위 해킹 가능성 에    손으로 개표해야     국정원의 선거개입 ,Politics
 단독   지연된 정의  비판한    국민과 기업에 심각한 피해 ,Politics
비명계  험지 출마는 이재명 친명 중진들부터 ,Politics
 김행 거취  강서구청장 보선에 달렸다  여의도 속풀이 ,Politics
권영세  강서구청장 졌잘싸 목표 아냐  이기면 지도부 탄력 중진 수도권  글쎄 ,Politics
오늘밤   시  강서구가 김기현 이재명 운명 가른다,Politics
 뉴스라이브  국정원  투 개표 조작 가능    선관위  부정선거 가능성 아니다 ,Politics
 뉴스라이브  정청래  하태경은 약체   한동훈 정도는 와야 ,Politics
대패하면 비대위  이재명 김기현  강서 단두대 매치 ,Politics
    정부      예산 잘라놓고 대통령 순방 예산 늘려 ,Politics
 패하면 끝장  강서구청장 보선에 달린 김기현 이재명의 운명,Politics
 오염수 먹어라  욕설에 돌까지 던져 습격 당한 국힘 시의원,Politics
이용호 신평 전여옥 전원책  김행 사퇴 지명철회  여권내 목소리 줄이어,Politics
김병주  국감 파행  성일종 통제불능 내주 재추진  성일종  응할 생각 없다 ,Politics
 험지행  비판한 홍준표에 다시 반박한 하태경  당사아생  이란 ,Politics
천하람  하태경 서울 출마에  윤핵관 지도부도 서울 올라와야 ,Politics
김재원  수도권 차출 응한 이는 다 떨어지고 이리저리 옮긴 홍준표는 떵떵거려 ,Politics
수도권 총선  가늠자  강서구청장 보선 투표 시작   시 현재 투표율     ,Politics
천하람  하태경 다음으로 장제원이 서울 출마 나서주면 좋을 듯 ,Politics
 최고위원 사퇴  송갑석  표 단속 실패  누군가는 책임져야 ,Politics
통일부 국장  보안문건    여건 무단 반출하고도 징계는 최하  견책 ,Politics
송갑석  비명계 지역구  원외 친명계 출마  당에 도움 안돼 ,Politics
 뉴스라이브   강서구청장 보궐선거  결과 가를 본 투표 변수는 ,Politics
 험지  순위  이재명과 친명계 다선  민주당에 튄 하태경 불똥,Politics
내년 총선 투표 어디에      국힘     민주      ,Politics
박지원  보궐선거 져도 이재명 책임   윤석열 정치는 바보 정치 ,Politics
  선 초과 금지  법안에  년 전 국회 보고서  국회의원 전문성 축적에 장애요인 될 수도 ,Politics
 양낙규의              미  그라울러  아덱스서 첫 실물 전시,Politics
홍익표  강서 보선 전날 선관위 해킹 발표 정치 개입 안돼 ,Politics
신원식   도발시 수시간 내 장사정포병 능력 완전 궤멸 ,Politics
 김행 딸  재산  억   억 소셜뉴스 최대주주  장경태 맹공,Politics
조정훈  정청래  한동훈 아닌 하태경은 약채  두려움의 표시 ,Politics
송갑석  친명 자객공천에  이재명  수박 있는 데로 가  하진 않았을 것 ,Politics
강서구청 선거 결과에 숨죽이는 정치권 거센 후폭풍 예고,Politics
 손잡고 벽 넘자  이재명에 김병민  면피 발언  진정이면 가결파 탄압 중단부터  여의도초대석 ,Politics
박성민     강서구청장 패배하면 지도부 개편 당연히 나와 ,Politics
이재명 김기현 운명 걸린 강서 결전의 날    지는 쪽은 치명타,Politics
이재명 수사 재가동되나  권익위  법카 사적 유용 대검 이첩,Politics
진성준  선거 패배땐 당 대표 책임져야  권영세  보선 하나로 그러면 정상아냐 ,Politics
안철수 욕설 해명    이준석  강서 지면   책임 ,Politics
이원욱  중진 험지 출마는 친명 중진부터 ,Politics
국방위 국정감사 첫날 파행   여야  네 탓이오 ,Politics
하태경  홍준표 저격  당사아생 선택했던 사람이  ,Politics
홍익표  국힘  김태우 보복판결  현수막  사과해야 ,Politics
   억 클럽  박영수   일 첫 재판,Politics
   하고 자빠져  논란에 안철수 측  시민 욕설을 유머로 승화 ,Politics
하태경  홍준표 직격  당사아생 선택한 사람 누구냐 ,Politics
검찰   대선 전 허위 보도 의혹  김병욱 의원 보좌관 인터넷 언론 압수수색,Politics
 후쿠시마 오염수  용역 보고서 비공개 논란    고의로 감춘 것 ,Politics
김기현  해킹 무방비 노출된 선관위 거짓말한 자들 발본색원해야 ,Politics
강서구청장 선거          김태우냐   진교훈이냐 당 지도부 운명 가른다,Politics
신원식  적 도발 시 장사정포 완전 궤멸시켜야  대화력전수행체계 점검,Politics
 서울 출마  하태경  정청래는 내가 껄끄러운 듯 경기도 배제 아냐 ,Politics
이원욱  강서구 보선 승리하면 현 체제 안주 총선 악재다 ,Politics
경북도의회 차기 부의장 상임위원장 선거 만만치 않다,Politics
 르포 강서구청장 뽑는 출근길  표  정권 얄밉다    일 잘할 후보 ,Politics
법원    현대중공업 해군 호위함  불복 가처분  기각,Politics
유인촌  대통령이 싫어하면 가짜뉴스       후쿠시마 오염수  얘기하면 광우병 얘기 떠올라 ,Politics
베트남 이민자 순직 조종사의 형  국민 조종사 로 창공 누빈다,Politics
이원욱  개딸 욕설  정청래  고름  발언 두고 비명계만 단죄  동의 못한다 ,Politics
홍익표  정부 여당의 국정감사 방해 도 넘어 여당은 정부 방패막이 전락 ,Politics
내일 총선이라면 국민의힘       민주당       오차범위 내 접전,Politics
민심은  김    진   미니총선 강서구청장 본투표  당일까지 총력전,Politics
오늘밤   시  김기현 이재명 운명 가른다,Politics
김기현  해킹 무방비 노출된 선관위 거짓말한 자들 발본색원해야 ,Politics
 양낙규의              개성공단  기업 입주하면  하마스 인질극   도 가능,Politics
이원욱  강서 이기는 당은 페니실린 주사 맞은 격   총선 악재 ,Politics
천하람  다음 서울 출마  제일 좋은 분은 장제원 ,Politics
 영상 마른하늘 뒤덮은  하마스 로켓  구름    시간당    만발  대비 관건,Politics
신상진의 성남시  이재명 유물 법원단지 이전 추진,Politics
         년  매우 예외적  민주당 전성시대 ,Politics
 자막뉴스  파견 직원을 하인처럼   도저히 믿기지 않는 갑질,Politics
 이재명에   억 줬다  조폭 박철민에 검찰  징역  년 구형,Politics
 안면 없는 분을 방통위원장으로     문 대통령의 당부,Politics
안하는 걸까  못하는 걸까 선거구획정   차 데드라인 도 불발 유력  이런정치 ,Politics
총선  개월 앞둔  대통령 지지율        메트릭스 ,Politics
성일종  국방부 국감 재진행 없어  야당 꼭두각시  안 할 것 ,Politics
장예찬  정청래  지저분한 정치인 마포을 떠나야 ,Politics
 정치쇼  하태경  홍준표  서울 거부하고 탈당해 대구 출마 누가 당사아생인가  ,Politics
권영세  하태경 말고 한동훈 오라는 정청래  자기 체급 올리려 ,Politics
홍준표에 반격한 하태경   당사아생  길 선택한 사람 누구  나는 윈윈 ,Politics
 정치쇼  송갑석  친명 자객공천      수박 있는 데로 가  하진 않았겠지만  ,Politics
 최강시사  천하람  정청래  방구석 여포 하태경과 중립지역에서 붙으면 질 것 ,Politics
     세 할머니  최고령 스카이다이버  등극  일 만에 영면,Politics
천하람  홍준표  사감 있어도 안아줘야 대선주자 평가 받아 ,Politics
한국인 여행객    여 명 귀국  현지 공항에 사람 몰려 ,Politics
비명계 이원욱  강서구청장 승리시 현 체제 안주 내년 총선 악재될 것 ,Politics
천하람  정청래는  방구석 여포  하태경과 중립지서 붙으면 질 것 ,Politics
이원욱  수박 당도   아쉬워 당도 높을수록 사랑받는 의원 ,Politics
하태경   약체  평가 정청래에  껄끄러운 걸 우회적으로 표현 ,Politics
김행  대기실에 있었을 뿐  청문회 줄행랑 부인,Politics
하태경  홍준표는 나만 살자  난 당도 살고 자객공천  정청래든 누구든 ,Politics
진성준  검찰 이재명 분리 기소하면 한동훈 탄핵 힘 받을 것 ,Politics
 도  도 지면 치명타  총선 가늠자  새 강서구청장 누구 ,Politics
하태경  강서에서 크게 패배하면 수도권 대책 요구 나올 것 ,Politics
김행  행방불명된 적 없어      공개해 달라 ,Politics
진성준  강서 지면 김기현  대표직은 물론 정치 생명도 달렸다 ,Politics
 영상 이태규  김행 청문회 이재명 위한 쇼 줄행랑 가짜뉴스  신율의 이슈메이커 ,Politics
홍익표  김행 건  그냥 안 둬 윤 대통령 숙고의 시간 드린다 ,Politics
홍준표 저격한 하태경   당사아생  길 선택한 사람 누구였나 ,Politics
신평  다시는 김행 같은 사람 나서지 않길 껍데기 사람 ,Politics
 총선 전초전  강서구청장 보궐선거  이제는 기다림의 시간 손끝에 달린 운명,Politics
 최강시사  심상정  양평 고속      봐도 강상면안 할 이유 없어 이미 끝난 게임 ,Politics
오늘 강서구청장 보궐선거   결과가 미칠 파장은   띵동 정국배달 ,Politics
이문희 전 외교비서관  파견종료 통보 이유는 알지 못해      국감 ,Politics
총선    개월 충주 선거판  요동 ,Politics
이스라엘 단기체류    명 입국  남은 이들도 하루빨리 오길 ,Politics
내일 총선이라면 어느 당에 투표를   국힘       민주      ,Politics
안철수    하고 자빠졌죠  욕설 논란에  유머로 승화  반박,Politics
내년 총선 이동형  국힘   국정운영 방향 전환   와 협치해야 유리 ,Politics
조해진  강서구청장 선거 의미부여 안 해도 총선  김기현 체제로 치러야 ,Politics
진중권  김행 두고  강성 지지층인 전원책 전여옥까지  아니 라고 그랬다 ,Politics
김규완  김기현 체제  두 자릿수 패배 시 비대위  전부 오보   한판승부 ,Politics
   장사정포  하마스식 무더기 로켓 공격하면 그 위력은  이현호 기자의 밀리터리 톡 ,Politics
김남국  조응천 겨냥  같이 사는 집에 불 지르고 뒷짐 져 ,Politics
오늘 법무부 국감  한동훈      이재명 수사  등 격돌,Politics
 내일 총선이라면  국민의힘        민주당      ,Politics
김규완  국민의힘  두 자릿수로 지면 김기현 책임론 비대위  전부 오보 ,Politics
김행  행방불명 된 적 없다       공개하라  반격,Politics
 단독  노조 비리 잡겠다 며 만든 정부 신고센터   사용자 불법  호소로 가득,Politics
내일 총선이면 어느 당에  국힘       민주      ,Politics
당장 내일이 총선이라면  국힘          민주당        접전 ,Politics
조정훈  정청래  한동훈 아니면 약체  하태경 두렵단 표시  한판승부 ,Politics
가짜뉴스 규제 일방통행에 드러난  총체적 난국 ,Politics
       수  데일리안 출근길 뉴스   이재명의 민주당 이 욕설 지적을   안철수 욕설 논란  진상은 등,Politics
 개월 남은 총선  유권자        새 얼굴 뽑겠다 ,Politics
가스공사 전 사장  박    만 원 호텔 숙박 산하기관 법카 펑펑 쓴 공무원,Politics
내일 총선이라면 국힘        민주        오차범위 내 접전 ,Politics
김행  내가  배임혐의   이건 묻지마 고발 차라리 다행  수사해 보자 ,Politics
김기현 이재명 운명 갈린다  강서구청장 보선 투표 시작,Politics
유권자        내년 총선 새 얼굴에 투표   현역 의원       에 그쳐,Politics
 윤석열 이재명 리턴매치  강서 보궐선거 국힘  박빙  민주  승리 ,Politics
김성태  해킹 우려에 수개표  박수영 노파심  당 입장 아냐   한판승부 ,Politics
 단독  보훈급여 수당 최근  년간    억 잘못 지급 국민혈세  줄줄  이현호 기자의 밀리터리 톡 ,Politics
김행  여야 충돌 새 뇌관 될까  임명 강행  벼르는 민주,Politics
조해진  하태경  서울 이길 수 있는 곳 가야 총선 비대위  김기현 체제로 ,Politics
보궐선거 직전 국정원  해킹 발표   비웃은 진중권    보수 음모론 영합 ,Politics
내일이 총선이라면 어느 당에   국민의 힘         민주        응답,Politics
국감장서  김광석 노래  부른 유인촌   빵  터졌다  무슨 일 ,Politics
김기현도 이재명도 지는 쪽은 치명타 강서구청장 보선 투표 시작,Politics
 개월 앞으로 다가온 총선  험지 출마 로 시동,Politics
시스템 비밀번호          언제든 해커 공격에 투 개표 조작 가능  해킹 취약한 선관위 ,Politics
     군사합의 효력정지 속도 내나  제약 없는  공중감시정찰  필요성 부상,Politics
 문재인정부  공공요금 동결 차기 정부 부담 알고도 우려 묵살 ,Politics
 이 팔 전쟁 다음엔 북 중 도발 가능성    전망 나왔다,Politics
당권 총선 전략 가늠자  여야 지도부 총출동 막판 유세,Politics
 돈봉투 의혹  윤관석     만원 봉투   개씩  번  수고한 의원들에 감사 의미 ,Politics
홍준표  하태경 서울 출마  살 길 찾는 것  김재섭  후배 발목 그만 ,Politics
 쥐박이    닭근혜 까지 꺼낸 국힘 어라   찢재명    문재앙 도 되네 ,Politics
보수 지지층   주 전보다       증가 중도 진보층 소폭 감소,Politics
 중진 험지 출마론  쏘아 올린 하태경 지역구 어디로 가나,Politics
이스라엘 하마스에 말 아낀 윤 대통령  실용외교  고려했나 ,Politics
민주당  험지론 의 양면  기득권 내려놓기      비명계 정리수단 ,Politics
유럽 이어 중동서도 잇단  전쟁  양상    영향력 약화 때문인가,Politics
 안철수    하고 자빠졌죠  논란에   시민이 욕설해서  해명,Politics
 총선 물갈이 찬성여론 과반 유권자        새 얼굴 뽑겠다  ,Politics
내일 총선이라면 어느당에 투표  국민의힘        민주당      ,Politics
총선  개월앞   지지율       국민의힘        민주      ,Politics
패한 쪽은 치명타  양당 강서구청장 선거에 다 걸었다,Politics
정권 견제론          정권 안정론      ,Politics
 형수 쌍욕한 사람도 있는데     그 얘기가 왜 여기서 ,Politics
판 커진 강서구청장 보궐선거 패자는 격랑 속으로,Politics
하루 새 수천 건 요청에 기밀 강요   평생 안 봐도 될 자료 다 만들어요 ,Politics
여도 야도  승리 땐 총선 청신호  패배 땐 책임론 내홍,Politics
 가짜뉴스  잡겠다 나선 이동관     위헌  방통위가 왜 나서나   막 오른 국감 ,Politics
여야 모두 패하면 치명타 강서구청장 보궐선거  데이,Politics
오늘 강서구청장 보궐선거 김기현 이재명 운명 갈린다,Politics
이준석  보선 진다면  이재명은 말도 안되는 비호감   정계은퇴해야 ,Politics
 조정훈 에  하태경 한동훈 까지 뜨거워지는  마포구 ,Politics
 단독  친문계 법카 지적 당하자  중기부  감사실 인사 물갈이 ,Politics
 심판론 통한다   일꾼론 먹힌다  강서 보선 밤   시  분 윤곽,Politics
 임명 변함없다   더 지켜보자  대통령실  김행 임명 기류 변화 ,Politics
 이명박근혜  신조어 공격까지 그래도 난    버리지 않았다  박근혜 회고록 ,Politics
안철수측     하고 자빠져  논란에  유머로 승화  반박,Politics
   중동 외교  영향은     이란 개입  전쟁 장기화가 관건,Politics
 총선 전초전  강서구 보선 결과에 촉각    누구든 지는 쪽은  치명타 ,Politics
      기회주의적 도발 가능성 가장 거친 와일드카드는   ,Politics
 단독  대통령실  김행 임명 강행 기류  변화 분위기    에 달렸다,Politics
지역 발전    정권 심판  주민  공약 엇비슷  당 보고 찍을 것 ,Politics
안철수     하고 자빠졌죠  비판에  시민 욕설을 유머로 승화시킨 것 ,Politics
산하기관 법카로    번 밥값 결제  삼척까지 불러 계산 시켰다,Politics
국정원  사전투표 여부 조작땐  본투표서 이중 투표 가능 ,Politics
 힘있는 여당 후보 김태우 뽑아달라   진교훈 선택해  정권 심판해달라 ,Politics
신원식   도발 감시 허술해져  한국  이스라엘보다 위험한 상황 ,Politics
오늘  강서  보선        내 박빙          이상 압승 필요 ,Politics
대법원장 공백 책임 공방     사법부 길들이기     인사참사 탓 ,Politics
원전 냉각수 첫 방류 공론화 안전성 놓고   한수원 격론,Politics
 선관위 해킹 보안 허술  투개표 결과 조작 가능 ,Politics
총선    개월 오늘 강서구청장 보궐선거,Politics
마포구 총선 격전지 부상 여야 대치 전 내홍 예고,Politics
이스라엘 체류    여 명 귀국길    한국인 인질 없어 ,Politics
    민생 국감  약속해놓고 첫날부터  기승전 대여 공세 만       국감 ,Politics
정무위 국감 첫 날    신사 상임위  전통 지켰다 종합 ,Politics
정부  강제동원 피해자 권리 뺏기 위해 내년에도  억 예산 편성     국정감사 ,Politics
 천사  귀띔 무시했다 당한 모사드 국정원   도발 첩보망 있을까  노석조의 외설 ,Politics
 지역 개발    정권 심판    막판 유세 총력전,Politics
선관위 가상해킹에 뚫렸다 국정원  명부 개표 조작 가능 ,Politics
      국감    대 마지막 국감  첫날부터  파행  진통 예고,Politics
 이재명의 민주당 이 욕설 지적을   안철수 욕설 논란  진상은,Politics
강서구청장 선거    압승  신승 시    지팡이 투혼  역풍,Politics
 현장   성남 부정부패 전수 안돼      반이재명  고리로 중도층 호소,Politics
  김병욱  아들 마약 거짓 해명한 유시춘      이사장 자격 없어 ,Politics
