titles,category
이스라엘 자랑하던  아이언돔  뚫렸다    만    발  장사정포 어쩌나,World
 협상해야  유엔 사무총장 이스라엘과 하마스에 신속한 평화 협상 촉구,World
케네디  무소속 출마  양당 주자 비호감에 제 후보 난립,World
 중국 대응에 실망      미국  불난집에 기름 ,World
중동  지정학적 위기 에   방산주 급등 뉴욕증시 상승 마감,World
트럼프 돕고 바이든 방해      무소속 출마  케네디  둘 다 망치겠다 ,World
 영상  이스라엘 전면전으로 끝장보나    슈퍼 핵항모  배치 이란 배후설,World
한국인    여 명 오늘 귀국길 대통령실  안보상황 긴급 점검,World
쿠바에  공짜 연료  멕시코 석유회사  미국서 돈 빌리려다 퇴짜,World
베트남 공안부   연방의원     기자 등 해킹 의혹,World
이스라엘 팔레스타인 사망자 약      명 지상전 임박,World
이스라엘  국제 항공편 입국중단 대비 비상 계획 발표,World
 미국인   명 사망  미 독 영 프 정상  긴급논의 ,World
뉴욕증시  이스라엘 팔레스타인 전쟁에도 상승 반전,World
살해 위협에도   명 모였다 우크라 러 기자들   여론 궁금 ,World
국제유가    급등 중동 지정학적 위기에 공급 부족 우려,World
테슬라   월 중국 생산차량 판매량 약     감소,World
쿠바에  공짜연료  줘온 멕시코 석유회사   서 돈빌리려다 퇴짜,World
이스라엘 가자 사망자     명 육박 부상자  천명 넘어,World
 잇슈      이스라엘 국기색으로 서방국가들 랜드마크에 연대 표시,World
노벨경제학상 골딘   출산율     명  인식변화 필요해 ,World
한불 총리  북핵 미사일 도발에 긴밀 공조키로,World
유가만    급등  중동분쟁 세계 금융시장 충격은 제한적 종합 ,World
선제공격 당했는데  이스라엘 비판시위  벌어지는 이유는 ,World
이스라엘 팔레스타인 교전 사흘째    사망자     명 육박 인질    명 끌려가 ,World
성지 순례객    여 명 철수 시작  최악의 상황 대비 ,World
네타냐후  하마스는    이제 세계 모두가 정체 알아 ,World
이 팔 충돌에 유가 급등했는데 미 주가는 상승 왜 ,World
미국 상원대표  시 주석에 이스라엘 지지 촉구  악랄한 공격 규탄해야 ,World
주요국 정상  이스라엘 하마스 사태 긴급 논의 미  핵추진 항모전단 전진 배치,World
테슬라       루시드       전기차 일제 하락 상보 ,World
북 러 군사협력  플랫폼  만들었나 ,World
 중동 지정학적 위기 고조  영향 유가    급등,World
아르헨 극우 후보 발언으로 외환시장 패닉 비공식 달러      ,World
 매카시  당이 원하면 복귀  하원의장 재출마 저울질,World
    힘 빠졌다는 신호 다극화 체제 전환의 상징적 사건   이 팔전쟁 ,World
 중동 분쟁에  방산업체 신났네  록히드마틴    폭등 상보 ,World
    조카  민주당 경선 대신 무소속 출마 선언 대선 판도 흔드나,World
하마스  경고 없이 공습 땐 인질 처형   바이든  미국인 최소   명 사망 ,World
세계 주요 항공사 텔아비브 노선 운항 잇따라 중단,World
세계 주요 항공사  이스라엘 텔아비브노선 운항 잇따라 중단,World
연준 부의장 비둘기 발언에 시장 상승 다우존스        데일리국제금융시장 ,World
중동분쟁에 방산업체 주가 폭등  미증시 일제 상승 상보 ,World
 민주 경선 나섰던 케네디 무소속 출마  바이든에 악재   트럼프 표 잠식 ,World
   집행위  팔레스타인 지원 중단  인도적 지원은 계속  종합 ,World
 돈줄  막히는 팔레스타인   자국민 보호 비상,World
아프간 강진 희생자     명 육박,World
바이든의  중동 데탕트  최대 위기  네타냐후는 기회와 위기 사이,World
 이스라엘    시간내 가자지구 지상작전 돌입 ,World
하마스 배후엔 이란이   바이든  중동 빅딜   전쟁 위기 키웠나,World
제레미 리프킨  한국  복원력 강한 나라 다른 나라에 영감 줘  종합 ,World
에콰도르 대통령 방한  불발   과의 경제협정체결 영향 없을듯,World
이스라엘  가자 지구  전면적 포위  지상전 돌입할 수도,World
  해군 전단 미국 방문   인사들  한 미 불의와 함께 싸워  감사한다 ,World
이스라엘 가자 진입 초읽기  국제유가    이상 급등 상보 ,World
 뉴욕유가  중동  지정학적 위기 에    급등,World
이스라엘 가자  사망      명 육박 부상 약      명,World
   집행위  팔레스타인 지원 중단 유엔 총장  가자 봉쇄 고통 ,World
 민주 경선 나섰던 케네디  무소속 출마  대선판도 흔들까 종합 ,World
   러시아 원유 가격상한 준수 강화 위반업체 조사,World
스타벅스는 철수 샤넬은 매장 확장   샌프란시스코는 망하는 중인가  아닌가,World
세계 주요 항공사 텔아비브노선 운항 잇따라 중단,World
 미국  러시아산 원유 제재 집행 강화  위반 의혹 업체 조사중,World
 볼티모어 입항한 한국 해군 훈련전단  한미동맹   주년 기려,World
이스라엘 가자 사망자  천   명 육박  인질    명 끌려가 ,World
고비마다 중동평화 판깨는 피의 악순환 배후,World
우크라 이어 이스라엘   바이든의 시련,World
 이 팔 전쟁  세계 주요 항공사 텔아비브노선 운항 잇따라 중단,World
이스라엘  가자 봉쇄   고사작전 돌입,World
이스라엘 체류 일부 한국인  오늘 국적기편 귀국할 듯,World
이 팔 충돌에 사망자     명    다극화 체제 전환 보여줘 ,World
케네디   대선 무소속 출마 바이든 트럼프 양강에 변수,World
  케네디 주니어  민주당 대신 무소속 출마   바이든에 타격 ,World
 내일 전장으로  남은 건 보복    예비군 소집령에 청년들 속속 귀국,World
   여년 은둔  하마스  조직 수장  이스라엘 기습공격 주도,World
국제유가    넘게 급등  달러화   투자자 몰려,World
 삼성    중국 공장에 미국산 반도체 장비 공급 무기한 허용 ,World
이스라엘 축제장 시신만    구 가자지구 지상군 투입 임박,World
     미국 힘 빠졌다는 신호 다극화 체제 전환의 상징적 사건 ,World
     명 입니다  노벨상 수상자도 알고 있는   저출산 문제,World
 한국 출산율  정확히 맞힌 노벨경제학 수상자 그의 조언은,World
미 독 프 영 정상  이스라엘 하마스 사태 긴급 논의키로,World
이스라엘 방패  아이언 돔       발 로켓 소나기에 뚫렸다,World
테슬라   월  공장 생산 차량 판매 두자릿수 감소 주가   대 ,World
제레미 리프킨  한국  복원력 강한 나라 다른 나라에 영감 줘 ,World
 미  러시아산 원유 제재 집행 강화  위반 의혹 업체 조사 중,World
미   두 개의 전선  딜레마 중동 안정화   우크라 지원 흔들,World
  일 멕시코서  미국행 이주민  대응 회의   개국 정상급 참석,World
쫓겨난 전  하원의장 권토중래   당이 원하면 뭐든 할 것 ,World
네타냐후  하마스  끔찍한 일 겪을 것 중동 바꾸겠다  종합 ,World
 하마스 비난 안 해   척 슈머  시진핑 면전 직격탄,World
미  최대 항공모함 급파 전투기 추가 배치,World
 이 팔 전쟁     두개의 전선  딜레마 중동안정화 우크라지원 흔들,World
시진핑  미 중 관계 개선할 이유     가지 있다 ,World
돈줄 막히는 팔레스타인 유럽 국가들 원조 중단,World
돈줄 막히는 팔레스타인 유럽 국가들 잇따라 원조 중단,World
노벨경제학상 골딘  매우 중요한 상 성별 격차 여전히 문제  종합 ,World
미  세계 최대 핵추진 항모전단 전진 배치 군 투입은  신중 ,World
러 하원  핵 실험 금지조약  비준 철회 연구 시작 핵 실험 재개 ,World
치밀히 계획된  기습공격  향후 긴장 고조 불가피,World
이스라엘  지상군 투입 임박    수퍼 핵항모  급파,World
시진핑  중미 관계  인류 미래 결정   대표단    이스라엘 성명 실망  종합 ,World
시진핑  중 미 관계가 인류 운명 결정 ,World
  명물  흐르는 소면  먹었다가    여명 식중독  경악 ,World
 축구 꽃미남  니시카와 준 에 한국 여심 흔들    결혼해달라  구애,World
   동정 지지 없어 실망        편파적 개입 탓 ,World
   항모전단 전진 배치 전투기 증강   신속한 군사 지원 배경은 ,World
 노동시장 성차별 연구한 개척자  노벨경제학상에  골딘 종합 ,World
 우크라이나에서 중동으로 관심 분산  이 팔 전쟁에 웃는 푸틴 ,World
시진핑  중 미 관계 개선 위해 협력해야 ,World
러 외무  팔레스타인 독립이 이스라엘 평화 유일 해법 ,World
독일 이어 오스트리아까지  팔레스타인 원조 거둬들이는 유럽국가,World
 헝다자동차  주식 거래 재개       하락 마감,World
 이스라엘  가자지구 물 식량 전기 끊고   만 예비군 동원    전면전 초읽기,World
이스라엘 국방  가자지구  완벽봉쇄  지시 지상군 투입 임박했나,World
이스라엘 화폐가치 급락에    조  긴급 투입,World
만약 트럼프 재집권하면   트럼프 씽크탱크 에 묻다,World
이스라엘 하마스 사망자     명  육박  가자 진입 전망에  초긴장 ,World
유럽서 잇단 손절  돈줄  막히는 팔레스타인,World
노벨경제학상에  노동시장 성불평등 규명    노동경제대가 골딘 종합 보 ,World
   세계 최대 핵추진 항모 배치 미국 이란 대리전 되나,World
이스라엘 국방장관  가자지구 완전 봉쇄 지시  전기 식량 차단 ,World
이스라엘군 가자지구 봉쇄 위해 총집결 지상전 준비,World
 대만인과 결혼한  출신 여성   방문했다 체포  반간첩법 영향 ,World
   동정 지지 없어 실망        편파적 개입 탓 ,World
미 러 중  삼극 핵 체제   더 요원해진 핵군축 논의,World
 지진 못 느꼈는데  일본 곳곳서  원인 불명  쓰나미,World
임금 성별격차 연구한 미 클로디아 골딘  올해의 노벨 경제학상 종합 ,World
브루노 마스  이스라엘서 아슬아슬  긴급 탈출   콘서트 취소 ,World
 이 팔 충돌  초유의 사태  전선 확대될 가능성은 ,World
  기시다  내달 필리핀 말레이 순방 추진   억제 목적,World
시진핑  중미  세계서 제일 중요한 양자 관계 인류 운명 결정  종합 ,World
 전기도 연료도 끊겠다  이스라엘   가자지구 전면봉쇄 지시,World
   대만 상대 무역장벽 조사 연장 대만  총통선거 개입 시도 ,World
 단독  이스라엘 성지순례객    여 명   일 철수 시작,World
 영상   가자지구 지상군 투입 임박  미국 이란 대리전 확산 우려도,World
 하마스 작전 주도한 신적인 존재    육성 공개된 모하메드 데이프  누구 ,World
미국  이스라엘로 최대 항공모함 급파 전투기 추가 배치,World
   대만 상대 무역장벽 조사 연장 대만  총통선거 개입 시도  종합 ,World
남녀 임금격차 왜  노벨경제학상에   여성 노동경제학 대가 골딘 종합 ,World
   난세이제도 방어  무인차  개발 추진,World
미국  항모까지 전진배치 신속 진화 주력,World
시진핑   상원 원내대표에  중 미 관계 개선할 이유     가지 ,World
아프간 강진 사망자 느는데  구조 지지부진,World
이스라엘군  가자지구 주변 통제권 회복  예비군   만 동원,World
일본 각지서 원인 불명 쓰나미  해저 화산 폭발 가능성도 ,World
중동 다시  격랑 속으로  국제유가 급등,World
역대 노벨경제학상 올해는  유리천장 입증  클로디아 골딘,World
돈줄 막히는 팔레스타인 유럽 국가들 원조 중단,World
하마스 기습 공격에  속수무책 뚫린 이스라엘  철통 방공망 ,World
 전기도 식량도 안돼  이스라엘 국방  가자지구  완벽봉쇄  지시,World
이란 이슬람혁명수비대 개입 정황 속속 드러나    이란 대리전 확산 우려  이스라엘 하마스 무력충돌 ,World
트럼프  내가 대통령이었다면 하마스의 이스라엘 공격 발생하지 않아 ,World
한덕수  부산엑스포 위해 지구    바퀴 연대의 시간 만들 것  종합 ,World
시진핑   의원단 만나  미중 관계 개선할 이유     가지  망칠 이유 없다 ,World
 셰켈화 급락  이스라엘 경제 위기     억 달러 유동성 공급,World
 차 중동전쟁 돌입 일촉즉발 이스라엘  지상군 투입 임박,World
이스라엘 경제  위태  셰켈화 급락에    억달러 규모 안정책 발표,World
이스라엘군  가자지구 주변 통제권 회복 예비군   만 동원 ,World
미국 상원대표  중국에 이스라엘 지원 촉구  악랄한 공격 규탄해야 ,World
  지방선거 연정 참패 전망 극우당 약진,World
각국  긴장 고조 행위 멈춰야      팔 원조 중단   이스라엘 하마스 무력충돌 ,World
예비군   만 동원한 이스라엘군  가자지구 주변 통제권 회복 이 팔 전쟁 ,World
 차 중동전쟁 번지나    항모전단 배치  이란 무기 지원   이스라엘 하마스 전면전 긴장 고조 ,World
이스라엘  하마스 침투지역 되찾았다  가자 공격 수위 높이나,World
이스라엘군  가자지구 주변 통제권 회복 예비군   만 동원,World
 년 준비한 하마스의  기만전   이스라엘은 가자지구 완전 봉쇄,World
 상원의원   왕이 면전서  이스라엘 관련 성명 매우 실망 ,World
겨우 진정되던 국제유가  중동 화약고  폭발에 다시 불붙나,World
이스라엘  가자지구 전면 봉쇄  는 슈퍼 핵항모 급파,World
   나노 반도체  미국의   규제 구멍 ,World
 고임금 보장   홍콩서 취업하려면 필수라는  이것 의 정체는 ,World
 하마스는 아이언돔이 다 막는다    이 착각에   년전과 똑같이 당했다,World
   법인세 이어 소비세도 인하 저울질          연장  논쟁,World
이스라엘  가자지구 전면 봉쇄   아랍국 참전땐  차 중동 ,World
  이란 목소리 내는데   중동 해결사  자처했던 중국몽 삐걱,World
이란 제재 더 옥죌까   불확실성에 금 달러 엔화로 쏠림 조짐,World
바이든  중동 데탕트  정책 좌초위기 이스라엘 사우디 관계정상화 제동,World
 중동 중재자  자처하던  도 곤혹     이 팔  상황 악화 말아달라 ,World
 속보  이스라엘  가자지구 주변지역 통제권 회복 ,World
이스라엘 하마스와 사흘째 충돌  가자지구에 지상군 투입하나,World
쓰나미주의보 내린 일본 해안  원인은 모른다 ,World
 싸울 의지 없다   년 속였다 이스라엘 허 찌른 하마스 교란술,World
독일  개주 지방선거서 여당 참패 보수 극우당 약진,World
 평화 아니다  폭력뿐   하마스 리더 무함마드 데이프  주목 ,World
 변화했다 믿었지만 틀려  하마스  제재 완화 틈타 공격 준비,World
       통화긴축 길어진다 증시 공포지수  개월만에 최고,World
 이 팔 전쟁   끝장 보복  예고 이스라엘  가자지구에 지상군 투입할까,World
이번주 세계 미리보기    이스라엘 팔레스타인 무력충돌    차 중동전쟁  확전 우려 월드콕 ,World
  만 예비군 동원 이스라엘  하마스 격퇴  지상군 투입 임박  영상 ,World
     정부탄압으로 팩트체크 조직들  모멘텀  떨어져 ,World
 상원대표   에 이스라엘 지원 촉구  악랄한 공격 규탄해야  종합 ,World
이란  팔레스타인 지지하지만 이스라엘 공격에 개입 안 해 ,World
현지서 네타냐후 책임론  위험 식별 실패  상대 무시 외교 ,World
서방  이스라엘 하마스 충돌에 유대계 시설 치안 강화,World
  제약사 브리스톨마이어스  항암제 개발사 미라티 인수,World
불안해진 중동   이란 대리전으로 이어질까,World
이란 자금동결 풀어준 바이든 행정부 당혹 미국 정쟁 비화,World
 원인도 아직 몰라    태평양 연안 곳곳  쓰나미 주의보 ,World
대만 검찰  홍콩  대만  가짜뉴스  공격의 근거지 배후는 중국 ,World
 공습 위주  전략 수정 불가피 이스라엘  전면 지상전 나서나,World
일 외무상    일까지 동남아  개국 순방 중 러 견제 포석,World
이번이  차 중동전쟁  해묵은 원한    차 전쟁 어땠길래,World
이  팔에 지상군 투입 임박     이란 대리전 양상땐 더 파괴적 ,World
계속된 경제 위기론에 독일 정부  흔들   극우당은  약진 ,World
 차 중동전쟁 번지나 국제유가    급등,World
독일 집권당  남부 지방선거서 참패  극우 약진  심상치 않다,World
이스라엘  하마스와 사흘째 교전 침투 격퇴 예상보다 장기화,World
이스라엘 하마스 전쟁으로 유가    급등 정부  석유 가스 수급 상황 긴급 점검,World
  헝다  억달러 전기차 투자 유치 중단 위기,World
진정세 보이던 국제유가  이 팔 전쟁으로 다시 불안,World
  핵항모 전진배치에    반발  판 커지는 이스라엘 하마스 전쟁,World
이스라엘  하마스와 사흘째 교전 침투 격퇴 예상보다 장기화,World
 연평포격에  미친정권   동해 표기   이스라엘  한국 입장 보니,World
인도 홍수로   명 사망 주택     채 이상 완전 파괴,World
유럽  아프리카  중동까지 전세계서 전쟁  평화의 시대 저무나,World
 태평양 연안에 쓰나미주의보  기상청  원인 파악 못해  종합 ,World
여종업원    명  한국인만 접대 베트남서 성매매 식당 운영  수억 매출,World
 이란이 하마스 뒷배  이스라엘 전쟁    이란 대리전 우려,World
  대기업  메가 파산  급증  경착륙 신호탄   불안감 확산,World
홍콩 취업땐  중국어  필수 기업들  영어 말고 중국어로 대화하라 ,World
   항모전단 전진 배치 전투기 증강   신속한 군사 지원 배경은 ,World
로이터  베이징현대    충칭공장 매각 희망가     내려 ,World
세계 주요 항공사들 이스라엘행 노선 줄줄이 취소,World
포화에 휩싸인 가자지구    만명 피란행렬,World
이미     여명 사망한 이스라엘 하마스간 전쟁  확전 우려 커져,World
테슬라 모델    가격인하  분기 판매감소에 단행,World
대만군  대만산 톈궁 미사일로 북부 방공망 교체 예정,World
이란  전적으로 팔레스타인 자체결정  배후설 부인,World
 이상한 일 일본 긴장해야 해  원인불명 쓰나미 곳곳에서 관측,World
모사드도  아이언돔도 뚫렸다   제대로 허 찔린 이스라엘   녹취록 ,World
 중동 조용해졌다 던  월말  의 설레발 워싱턴 착각 드러났다,World
베이징현대  중국 충칭공장 매각 희망가     낮춰,World
인도 히말라야 홍수 사망자   명으로 늘어    명 실종,World
 창살없는 감옥  가자 이스라엘  알샤티 난민촌까지 폭격  영상 ,World
  리포트  이스라엘  하마스에 전쟁 선포 미 항모전단도 이동 배치,World
유엔 안보리  이스라엘 팔레스타인 사태 긴급 협의 나섰지만 ,World
오랜 기간 준비해온 하마스   이스라엘   전쟁  공식 선포,World
 러시아  이 팔 전쟁 우크라전에 이용 ,World
     디렉터     팩트체크 지원 중단  정치권 압박 먹힌 전형적 패턴 ,World
이스라엘 정치 분열시켰던 네타냐후  전쟁에 독주 기회잡나,World
 사격장 같았다        영상으로 드러난 이 팔  참혹한 현장 ,World
 이상한 일 벌어졌다   원인불명 쓰나미  곳곳서 관측  여기는 일본 ,World
이스라엘 하마스 전쟁  증시에 불똥튈까  이란 배후  여부에 달렸다,World
행글라이더 타고 내려온 하마스  년 교란작전 어떻게 통했나,World
중국  일본 의원단 대만 방문하자 센카쿠에 해경선 보내 순찰,World
   항모전단 전진배치 전투기 증강   신속한 군사 지원 착수,World
아프간 지진 사망자 최소     명    년만에 최악 ,World
 기름값 또 오르겠네  국제유가    급등  이스라엘 하마스 전쟁 영향,World
팔레스타인에  억유로 주려던 독일  전면 재검토 ,World
    팔레스타인 재정지원 중단 예고 경계 강화하는 유럽,World
     기념  주장한 중국 반체제 인사  캐나다 망명,World
이스라엘 공격에  서 풀린   억달러 활용      달러도 못써 ,World
지진도 못 느꼈는데   곳곳 쓰나미  이상한 일 일어나고 있다 ,World
핵 군축 논의 실종 속 미 러 중  삼극 불안정  시대 도래 김유진의 워싱턴리포트 ,World
이스라엘 하마스 분쟁  과연  석유 파동 으로 이어질까 ,World
  이란 대리전 확산될까  국제유가    급등 안전자산 쏠림 가속,World
 중동 화약고  폭발 불씨 옮겨붙은 원유시장       대 급등,World
미 싱크탱크  러시아  이 팔 전쟁 우크라전에 이용 ,World
중국화 된 홍콩  푸퉁화 배워 오세요 ,World
  의회조사국    나노 반도체  대중국 규제의  전략적 구멍  ,World
하마스 공습에  이란 개입설  사실이면 확전 불가피 ,World
 중동 평화  잡고 재선 노린 바이든   하마스 에 전략 흔들린다,World
숫자  개 맞추면  조원  인생역전     파워볼 이목 집중,World
 대중국 제재  삐걱     나노 규제 구멍  기업은 비협조,World
이제 홍콩 취업도  중국어 가 필수  푸퉁화 능통자 수요 증가 ,World
   만 예비군 집결  이스라엘  피의 복수  백린탄  투하 정황도  영상 ,World
 손님 으로 불리는 그가 하마스의 이스라엘 공격 이끌었다 피플  포커스 ,World
   한국에서 동결해제 이란 자금 하마스 유입설 부인,World
   항모전단 전진배치 전투기 증강   신속한 군사 지원 착수,World
 유엔 인권이사회 선거서  중국 낙마  백지투표 촉구 운동 펼쳐져 ,World
태풍  코이누  홍콩 강타 공항 등 교통 혼란,World
하필    년  일 에 하마스  왜 지금 이스라엘 기습했나 ,World
 관영매체   이스라엘 전폭 지원  약속한  에  불에 기름 붓는 격  비판,World
이스라엘 전쟁      년 오일쇼크 재연되나 ,World
이스라엘   하마스 충돌에 국제 유가    급등  금값 강세,World
하마스에 뚫린  아이언돔  시간차 공격 신형 무기에 당했나,World
중국   미 이스라엘 지원 비판  불난 집 기름 붓는 격 ,World
트럼프  중동 전쟁 바이든 책임론  맹폭     동결해제된 이란 돈 하마스로 갔다 ,World
   안보리 소집해 이스라엘 하마스 전면전 사태 논의,World
헤즈볼라 개입에 이란 승인설까지  격랑의 중동    이란 대리전 위기  종합 ,World
 이 팔 전쟁  무장세력에 잡힌 인질  이스라엘 보복공격에 변수되나,World
     이란  하마스 공격 지원 지난주 공격 계획 승인 ,World
 이스라엘    중동  전면전으로 번지나 국제유가    급등,World
 일 방위성  난세이제도 방어 위해  무인차  개발 착수 ,World
이스라엘 정치권 결집 대미 관계도 다시 강화되나 ,World
     하마스 공격 이스라엘 미 아랍 정보 완전 깜깜이 ,World
하마스 국제공항도 공격  국제 유가도   나 뛰어,World
유엔 주재 이란 대표부  하마스의 이스라엘 공격에 관여 안해 ,World
 불난 집에 기름 붓나   이스라엘 지원  거친 신경전 벌이는 대국들  이스라엘 하마스 전쟁 ,World
이스라엘 콘서트 당일 취소하고 탈출 성공한 브루노 마스,World
오염수  차 방류개시   언론  오염수 추가 발생 방지책 없어 ,World
 차 중동전쟁  일촉즉발  미 이란 대리전 확산 우려,World
사망자  천 명 넘어 헤즈볼라 합류  확전 우려 ,World
    번 총각 잘생겼다   결혼하자  한일전 축구 여심 흔든 니시카와 준,World
월스트리트저널  이란이 하마스 배후 다중전선 구축 목표 ,World
이스라엘 사태  차 중동전쟁 위기로   미 이란 대리전 양상,World
 내 차 마련 못하겠네  차값 빼고   억  내야 승용차 사는  이 나라 ,World
 자막뉴스   이스라엘이 원하는 모든 것 지원    미국  발 빠른 지원 나선 이유는,World
 쿵푸팬더  대작 만들고도 돈 없어   명 자르는 이 회사  무슨 일 ,World
미국  핵추진 포드 항모 타격 그룹 이스라엘 근처 배치 종합 ,World
 국방부  이스라엘에 세계 최대 항모 전진배치    안보지원 가동 ,World
이스라엘 하마스 전쟁  무슨 일이 일어났고 왜 중요한가,World
미국  슈퍼 핵항모  이스라엘 전진배치 하루만에 군사지원 착수  이스라엘 하마스 전쟁 ,World
 조원대로 불어난 미국 파워볼 당첨금 미 복권 역사상  번째 규모,World
이스라엘 대사  하마스  나치처럼 유대인 학살 전범 ,World
욤키푸르 전쟁   주년 맞아 기습  이스라엘의      모사드는 뭐했나 ,World
    이스라엘 지원    비판 관영지  불난 집 기름 붓는 격 ,World
강대강 충돌 속  중동전쟁 위기   이란 대리전으로 확산하나,World
