titles,category
김병민   김행 줄행랑  논란에 박영선 소환     청문회 파행 유발자 장관 임명  여의도초대석 ,Politics
국방부 국감 첫날부터 파행     신원식 장관 임명철회  피켓팅,Politics
   신원식 임명 철회  피케팅에 국방위 국감 첫날부터 파행,Politics
정무위 국감   경사연 북한편향 인사   총리실이 내각 부실 검증 ,Politics
   방통위 가짜뉴스 대책 위헌 위법  이동관  책임지겠다 ,Politics
      국감  첫날부터 국방위 국감  야당  보이콧  여당  참석 거부 ,Politics
 가짜뉴스  설전 벌어진 국감    원인은 포털     판단 기준이 먼저 ,Politics
 단독  원희룡  해외 출장 지인 동행 논란  지휘 업무체계 무시 ,Politics
국토위  양평고속   공방    장관 사과해야     원희룡  그럴 문제 아냐 ,Politics
한명숙 판결 뒤집으려던    김태우 향해선  대법 존중하라        국감 ,Politics
 문재인 정부  전기요금 부담 차기 정권에 전가 우려 묵살 ,Politics
양평고속  경제성 분석 공방    방탄용 조작     정쟁 그만 ,Politics
자녀 학비로  년간    억  혈세  반복되는 외교관 특혜 논란,Politics
박진  이스라엘 한국인 피해접수 없어 가자지구내 교민 피신 상태 ,Politics
 국감  최다 정상회담  기록세운    순방 예산도  최대 ,Politics
외통위 국감 오염수 공방 여  반일 감정 부추겨  야  정부가 일본 대변 ,Politics
예술의전당 간 한동훈 화제 되자    집에 스피커 두고 왜 가나 ,Politics
권인숙   막말  논란에  김행    후보였으면 더 독하게 말했을 것 ,Politics
정부  이 팔 충돌에  두 개의 국가 해법 지지 평화적 해결  촉구     국정감사 ,Politics
야당  양평고속도로 엉터리 발표 사과하라 에 원희룡  거부      국정감사 ,Politics
카카오  다음 댓글에  찢재명   문재앙  가능   대깨문  삭제 논란은 오해  종합 ,Politics
대통령 핫라인이냐  정권 심판이냐  강서 보선      총력전,Politics
 신원식 막말   이재명 쌍욕  국방위 국감 첫날부터 파행,Politics
 이동관표  가짜뉴스 근절에 여야 공방    위법 위헌        신속 대책 마련 ,Politics
 뉴스       국방위 국감  시작도 못하고 파행,Politics
   이재명  존재감 과시하며 재판서는 아픈척 해야하는 딜레마 ,Politics
 전기요금 인상 에     정부 폭탄     환율 유가탓 ,Politics
강서구청장 보궐 승패에 이재명 체제  안정  여부 달려,Politics
방통위 국감  가짜뉴스  공방  가짜뉴스 잡아야   법적 근거 없어 ,Politics
가상 해킹에 뻥 뚫린 선관위 국정원  투 개표 모두 해킹 가능  종합 ,Politics
 김행랑  사태 일파만파    야당 때문  역공에도 속내는 고심,Politics
야  전문지식 없이 일타강사  원희룡  제 편도 좀 들어달라  국감현장 ,Politics
퇴원한 이재명  진교훈 압도적 당선시켜 국민 무서움 보여달라 ,Politics
 여행 왔다가 잠깐 돈벌이  영어유치원 강사    는  자격,Politics
   괴담 선동 폐해 심각     대통령 싫어하면 가짜뉴스냐 ,Politics
 무력 충돌  이스라엘 우리 국민    명 오늘 빠져나와,Politics
장제원  서울로    국민의힘에 부는 바람   녹취록 ,Politics
김남국  안철수가   랄하고 자빠졌죠  막말  에 타격 주기로 작정한 모양 ,Politics
 국방부 괴문서와 군검찰 공소장은 쌍둥이 ,Politics
한전 적자 전기료 급등 공방     정부 실기         정부 실정 ,Politics
하마스 기습에 뚫린 이스라엘 핵심은 정보전   취재파일 ,Politics
야   상저하고  공감 어려워  정부  하반기 확실히 좋아져 ,Politics
올해 군의관 장기복무 지원자   명   군의료 시스템 붕괴 우려 ,Politics
 기고 창끝 전투력 핵심 초급장교       지원율 급감 왜   현실과 정치공학의 잘못된 만남,Politics
국정감사 첫날부터 신경전   서울 강서구청장 보선    ,Politics
 기고 밀리   합참의장이 트럼프 명령 거부하며 충성한  자유민주주의 헌법적 가치 ,Politics
      국감   유아교육 전공  안했어요   무자격  영어강사 판친다,Politics
정청래  하태경 약체  오려면 한동훈 와라 마포을은 사지일 것 ,Politics
이준석  강서구청장 보궐선거 민주당이 지면 이재명 정계 은퇴해야 ,Politics
 어차피 임명된다   장관 후보자 태도 논란에 커지는 청문회 무용론,Politics
    선거조작 가능   보안 만점  처리한 선관위 종합 ,Politics
 이앤피  강서구청장 보선      여야  막판 총력전  민심의 향방은   ,Politics
수억대 태양광 사업한 한전 직원     만원 스위트룸  가스공 사장,Politics
 노컷브이  김행  충돌한 여야  줄행랑은 가짜뉴스      충격 제보 많다 ,Politics
 서울 출마  하태경에 홍준표  깜도 안돼  정청래  약체 ,Politics
   김행랑 방지법 에    권인숙 방지법 으로 맞불,Politics
  정부  전기료 차기정부 전가 우려  묵살 탈원전에 적자 ,Politics
정청래    한동훈   마포을서 격돌 ,Politics
한동훈 공연관람에   모자 쓰고 조용히 갔어야  야권서 비판,Politics
 신원식 임명 철회    피케팅에 국방부 국감 파행,Politics
대책없이 요금인상 미루다    정부  공기업 빚   조 더 키웠다,Politics
산업부 공무원  산하 공기업 법카  백번  흥청망청 ,Politics
권인숙  사과는 도망친 김행 후보자나 여당이 국민에게 해야 ,Politics
간큰 산자부 사무관 난방공사 직원 법카로     만원어치 외식,Politics
법카     만원 긁고  자녀 도시락 준비시켰다 산자부 공무원  갑질 ,Politics
이스라엘 체류    명 귀국길   박진  인질 중 한국인 없어 ,Politics
신원식 장관       군사합의 최대한 빨리 효력 정지 추진 ,Politics
축구 한일전에 정치색 묻힌   이철규  일제샴푸 이재명  도쿄여행 김남국은  ,Politics
예술의전당 간 한동훈  인증샷  화제몰이    모자 쓰고 갔어야 ,Politics
 백현동 로비의혹  김인섭 조건부 석방 전자장치 부착,Politics
방통위 국감  가짜뉴스  공방 여  가짜뉴스 잡아야     야  방통위 법적 근거 없어 ,Politics
 윤 대통령과 김건희 여사 싫어하면 가짜뉴스 되냐  질문에 유인촌 답변은,Politics
박진  양금덕 할머니 서훈은 징용해법 이행상황 고려 ,Politics
 책임 안 져      탄핵으로 업무 공백  이태원 참사 책임 공방,Politics
정청래  하태경 마포을 출마설에  한동훈 정도는 와야 ,Politics
정무위 국감에도 오른 김행    김성주  백지신탁제 개선 필요 ,Politics
국방위 국감 파행  야  신원식 임명철회     여  사과해라 ,Politics
    투표로 대법원 판결 심판하자 는 김태우 적절하냐  대법원  삼가야      국정감사 ,Politics
예술의전당 찾은 한동훈에    서초강남 출마 간보나 ,Politics
 서울 출마  선언 하태경  당에 입은 은혜 갚을 때 ,Politics
국민의힘          방송에 민원     여건 역대 최대,Politics
 불닭면 다시다  싹 베낀  업체 브랜드 이름마저  한글 ,Politics
   종점변경에     대 증가 의문     원희룡  전문가에 물어보라 ,Politics
조응천  이재명 총선 출마  배지가 본인과 당에 도움된다 볼 것 ,Politics
 돈봉투 사건  송영길  범죄집단화된 정치검찰 발본색원 위해 릴레이 농성 ,Politics
 전문 지식도 없이 일타강사 왜 했냐  질타받은 원희룡,Politics
정청래  하태경은 약체 한동훈 정도 와야 의욕 불타 ,Politics
 이용호  김행  대통령 부담 덜어주는 것도 하나의 길 ,Politics
 정치쇼  박현도  팔레스타인 수반이  이스라엘 편  러시아 방문하는 이유는  ,Politics
이준석  이재명   강서  지면 말도 안 되는 비호감도인 것 은퇴해야 ,Politics
 뉴스초점  강서구청장 선거     여야 지도부 총력전,Politics
민주당   하태경 서울 출마 에  제 살길      우리도 혁신  상반 평가,Politics
박진  가자지구 내 교민 현재 피신 중  상황 보고 철수대책 강구 ,Politics
 함께 장벽 넘자  이재명의 호소에 조응천   강서에서 수박 깨부수자  말할 순 없는 것 ,Politics
이스라엘 체류 한국인    명 오늘 국적기편 귀국길,Politics
 단독   정부 총리실   회 여론조사 비용    만원에 업체와 수의계약,Politics
국정원  투 개표 시스템 해킹 가능      선관위  불가능  선거불복 조장 ,Politics
법사위  김태우  대법원 심판  공방 여  개인 의견  야  부적절  종합 ,Politics
예술의전당 간 한동훈    모자 쓰고 갔어야 ,Politics
월 평균    만 원인데  자격증 없는 강사       ,Politics
 자막뉴스  뚫려버린  아이언돔      무기 집중배치에 한국도  위험 ,Politics
투 개표 해킹 가능 강서구청장 선거     선관위  뻥 뚫렸다,Politics
문체부  오염수 안전성 홍보  두고 신경전  오염수 홍보부냐      선동 ,Politics
김두관   선이상 험지  물의 빚은 초재선 교체  호남 대대적 물갈이해야 산다 ,Politics
 비명계 찍어내기  대신  통합  내세운 이재명 징계 요구 답변 촉각,Politics
민주  윤  김행 후보 지명 철회해야 협치 가능 ,Politics
권인숙  내가 막말    후보였으면 더 독하게 했을 것 ,Politics
 뉴스앤이슈  강서구청장 내일 본 투표   하태경 수도권 출마   험지 차출  기폭제 되나 ,Politics
하태경  홍준표에   서울 올라오라 면 탈당하는 게 그분의 선당후사 ,Politics
국방위  국감 첫날부터 파행 야  신원식 임명 철회  피켓팅에 여 불참,Politics
외통위  오염수 공방     수산업 타격 줘   정부    편들기 ,Politics
정청래의 손짓  마포을에  약체  하태경 대신 한동훈 오라 ,Politics
 김행 낙마 안돼    선긋기 비주류 일각선 출구론도,Politics
 김행 사태는 국민 능멸       편파진행방지법  추진 ,Politics
지지층 결집    숟가락 얹기 여야  이재명 지원유세 해석  동상이몽 ,Politics
 김행  국민 무시  국힘 참패할 것    보수 인사도 김행 불안  박영환의 시사 번지 ,Politics
강서구청장 보선 승패에 달린 여당 지도부  운명 은,Politics
한국인 여행객 오늘 귀국길  경제 영향 최소화 ,Politics
 역대최고 사전투표율  강서구청장 보선  여야  본투표 하루 앞두고 막판 총력전,Politics
넉 달 만에  고위인사들 만난 시진핑 정상회담  파란불  켰나,Politics
하태경  험지 출마   영남 중진들도 새겨야 현장에서 ,Politics
불참 고성 네탓공방  국감 첫날부터 격돌,Politics
국정원  선관위  비번       사용 북한  총선 투개표 조작 가능 ,Politics
국정원  선관위 투 개표 해킹 가능   실제 침투 사례는 발견 못해 ,Politics
  선 출신 들이 망쳐버린 한국정치  김지현의 정치언락 ,Politics
국정원  선관위  해킹에 매우 취약   선거인명부 개표결과도 조작 가능 ,Politics
국방위 국감 시작 전 파행  신원식 막말   이재명 형수욕설 ,Politics
 선관위  해킹 취약 개표결과 선거인명부 조작 가능 ,Politics
 김행 임명  시기는  장성철  국감 이후  박원석  강서구청장 보선 직후 ,Politics
가상 해킹에 뻥 뚫린 선관위 국정원  투 개표 모두 해킹 가능 ,Politics
 해커가 개표 조작해도 속수무책  선관위 보안  총체적 부실 ,Politics
정청래  하태경은 약체  한동훈 와라 ,Politics
국방부   국회동의 없이      효력정지 가능  법 검토 끝낸 듯,Politics
국정감사 첫날부터 신경전   서울 강서구청장 보선    ,Politics
 우주항공청법  신경전 국힘  안조위 결론내야  민주  합의대로 ,Politics
이재명 통합 메시지  진정성  있나 강성 친명계  여전히  비명계 축출  의지,Politics
   신원식 임명철회  피켓 내걸자     국방위원 국감장 출입거부  파행 ,Politics
이용호  하태경에 마포을 권유 정청래에 맞상대할 만한 사람 ,Politics
  세 이상    명 중  명  임신 성공  난임부부   쌍 중  쌍 실패,Politics
 단독 문체부  최근   년 간  정율성 관련 예산    억    만 원 써     정부 때     투입,Politics
법원행정처장  김태우  대법원 판결 심판  주장  억제하고 삼가야 ,Politics
 초유의 사법공백  장기화 우려    정치력  시험대,Politics
 단독  대통령실  김행  임명 강행  기류 선회 조짐   결정에 주목,Politics
 이 팔 전쟁  하마스 북한제 로켓발사기 사용 정황 포착 종합 ,Politics
 뉴스포커스  국정감사 대장정 돌입 내일 강서구 보선 본투표,Politics
      국감  국방부 국감 파행   이재명  형수 욕설  나오기도,Politics
 단독 기상청  악성코드 발견 중국산 기상장비  도입 전 보안취약사항 점검 안 해,Politics
과방위 국감  우주항공청 놓고 고성      배제      밥그릇 챙기기 ,Politics
 신원식 막말   이재명 쌍욕  국방위  국감 첫날부터 파행 국감현장 ,Politics
국토위 국감  양평고속도  공방 야  원희룡 사과     여  국감 방해하나 ,Politics
장예찬  한동훈 잠재력   선 의원들과도 비교 안 돼 예술의전당 등장  인기 ,Politics
이준석   이나 하태경 다 살기 위해 이동  인정해야   입지 강화될 것 ,Politics
한국서부발전     억 출자 새만금육상태양광사업 초과수익 최소화 협약      배임 소지 ,Politics
 대혼란  중동       떨어진 북한은 왜 소환되나,Politics
국토위 국감  시작부터  양평   충돌  원희룡 사과      정쟁 유도 ,Politics
 험지  마포을 에 하태경  정청래  한동훈 정도 와야 의욕 불타지 ,Politics
제대군인 전직 지원금  구직급여      수준까지 인상 추진,Politics
초선  윤준병  전북 중진들 겨냥  그사람들이 해준게 뭐가있나 ,Politics
야당  신원식 임명 철회  피켓에 여당 반발 국방부 국정감사 파행,Politics
홍익표   서울 출마  하태경  친윤 역학관계 밀려     비윤 아닌 범친윤 ,Politics
 정치쇼  조응천  이재명 험지 출마  상상 안 돼 출마 하느냐가 문제 ,Politics
중국  아예 한글로  불닭볶음면    푸드 대놓고 모방 ,Politics
한국서부발전  새만금 태양광 초과수익 포기    대장동과 닮은꼴 ,Politics
 단독  합참은 육군참모본부  공통직위 중 육군  회 이상 보직 다수,Politics
 르포  강서구 막판민심 보니  지역 발전      정권 심판 ,Politics
송영길     조작수사 중단하라  오후 서울지검서  규탄농성 ,Politics
현역 의원들의 사보타주  선거 사무 코앞인데 선거구 획정  모르쇠 ,Politics
전여옥 전원책도 비판한 김행 국힘 내부    부담  사퇴론 솔솔,Politics
홍준표  깜도 안 되는 자들이 깐죽  하태경 서울 출마에  심기불편  ,Politics
여당서도   김행  자진사퇴로 대통령 부담 덜어줘야 ,Politics
하태경  서울 출마 선언 후 오라는 지역구 많아 화끈하게 할 것 ,Politics
 정치쇼  이용호  국민의힘 오기도 전에 마포갑  조정훈  도의 맞나  ,Politics
유상범  민주  한동훈 정치권 끌어들이려 온갖 애써 법무장관 있는 게 불리 ,Politics
      국감  피켓 떼라    이것도 못하냐  장관 앉히고 시작도 못한 국방위 국감,Politics
한동훈  예술의전당서 연이어 목격  집에서 듣지  비판 역풍,Politics
이준석  민주  강서구청장 보궐선거 지면 이재명 정계은퇴해야 ,Politics
이준석  민주  강서구청장 보궐선거 지면 이재명 정계은퇴해야 ,Politics
양평고속도 공방전 민주  원희룡 사과하라  국힘  유감  국감초점 ,Politics
정청래  마포을에  약체  하태경 말고 한동훈 오라 ,Politics
이준석  제   제 의 하태경 국힘에서는 안나온다 ,Politics
인터넷언론 심의불가 가능 번복한 방심위 법무팀 입장에 고민정  고발도 검토 ,Politics
      국감 국방위  국감 첫날부터 파행    신원식 임명 철회  피켓팅에   불참,Politics
 외상값   고름  띄웠던 정청래 돌연  징계 말한 적 없다  왜,Politics
민주당   정부 사실상 첫 국감 남탓  전정부 탓 안 통한다 ,Politics
 국감현장   신원식 임명철회  야당 피케팅에 국방위 파행,Politics
 무기로 이스라엘 공격 정황   북한제 로켓발사기 든 하마스 대원 포착 ,Politics
홍익표  당에 부담 주는 사람에게 어떻게 공천 주나 ,Politics
 영상  윤재옥  김행 후보자 청문회 줄행랑 논란에  민주당 가짜뉴스 ,Politics
 단독 유엔해비타트 전 관계자  박수현  청와대로 기업체 불러 협찬 압력 ,Politics
홍준표  깜도 안 되는 자들이 깐죽거려   하태경 천하람 직격,Politics
    대통령이 김행 후보자 지명 철회해야 협치 가능 ,Politics
명분 없으면 자충수 이재명 영장과 경종 노론의 교훈,Politics
강서구청장 보선       김기현 이재명 승패 따라  치명타 ,Politics
   집토끼 단속     진심유세    강서구청장 보선 막판 총력,Politics
중앙로 따라 제주시      양분   제주형 행정구역 개편  최적대안 살펴보니,Politics
국방부 국감 파행 신원식  막말  논란에 이재명  형수 욕설  언급도,Politics
이준석  역대급 사전 투표율  민주당 영끌 이재명 방탄 심판  뇌피셜 ,Politics
가자지구에 등장한   로켓  북한 무기 판매 확대되나  뉴스  ,Politics
 뉴스라이브  예술의 전당 간 한동훈   총선 때문에 ,Politics
   이 팔 분쟁 확대 가능성  정부  리스크 관리 철저히  종합 ,Politics
이용  동학농민운동 증 고손자 독립운동자 가족 인정  혜택 부여는 사실상 매표행위 ,Politics
홍익표  김행  국회 능멸 대통령은 임명 철회해야 ,Politics
   이재명  하세월 재판 유도  법꾸라지  사법부 휘둘려선 안돼 ,Politics
홍익표  국민의힘  윤 대통령에 김행 지명철회 요구해야 ,Politics
 김행랑은 가짜뉴스  국힘  권인숙 막말 탓에 청문회 중단 ,Politics
여야  김행 놓고  연장전     도망자  가짜뉴스        국회 국민 능멸 ,Politics
장예찬  하태경 이어 중진 출마 릴레이 기대 ,Politics
 뉴스라이브  먼저 손 든 하태경   험지 출마 이어질까,Politics
조응천  이재명  당 통합보다 장악력 강화로 가려는 것 ,Politics
김행 청문회 중단  종료   권인숙 방지법 으로  김행랑 방지법  맞불,Politics
   집토끼 단속     진심유세  강서구청장 보선 막판 총력전 이런정치 ,Politics
이준석  사탕발림 안하면 사이비 평론  김병민 막말 징계해야 ,Politics
국민의힘  민주당  김행랑 방지법 에  권인숙 방지법  맞불,Politics
 대통령   이 팔 전면전 치달아 교민 여행객 안전대책 철저히 준비  지시,Politics
 민주당이 보궐선거 지면  에 이준석  이재명 대표  정계에서 은퇴해야 ,Politics
국힘  김행 청문회 공식 종료 여가위 편파 운영 권인숙 사퇴하라 ,Politics
이스라엘 자랑  아이언돔  뚫렸다  우리도  장사정포 대비해야,Politics
 뉴스라이브  더불어민주당 이재명 대표  퇴원 후 달려간 곳 ,Politics
신원식       군사합의 최대한 빨리 효력 정지할 것 ,Politics
원외 신인  반색  중진은  떨떠름  하태경발  험지출마론  파장은,Politics
  빚투 영끌 로  년새 진 국민 빚    조원 ,Politics
여당  야  김행랑 방지법 에  권인숙 방지법  맞불  이번주 발의  종합 ,Politics
윤재옥  하마스 계기로    선의 기댄     합의 전면재검토 해야 ,Politics
       사장 임명 방해 내부 카르텔  좌우 막론 좌시 않을 것 ,Politics
전원책  보수신문도 사설에서 김행 포기하라고 해 ,Politics
이용호  김행 사퇴 촉구    대통령 부담 덜어주는 것도 하나의 길 ,Politics
박정훈 대령 변호인단  박 대령 기소는 기소권 남용 ,Politics
강원도 지난해 출생 신생아     유산 임산부 지원대책 시급,Politics
신현영   김행랑  사태  기획된 퇴장   대통령실  자진사퇴 고민 중일 것 ,Politics
 한일전 야구 금메달  이어  총선 한일전  민주당 황당    ,Politics
막 오른   대 마지막 국감     강대강  난타전,Politics
  이철규    반일 몰이에  일제 샴푸 사는데 법카 쓴 이재명 ,Politics
김두관  하태경 서울 출마 계기로 우리도 기득권 내려놔야 ,Politics
 무기로 이스라엘 공격했나  북한제 로켓 든 하마스 대원 포착 ,Politics
홍익표   정부 맞서 국감서 국민 의혹 시원하게 해소할 것 ,Politics
정청래  내가 무슨 안동역이냐  오네 마네 하게 하태경은 약체  한동훈 와라 ,Politics
이재명  재택 정국구상   국감 민생 이냐  대여 투쟁 이냐  이런정치 ,Politics
 국방부 괴문건은 위헌적  작성자 반드시 찾아 처벌해야 ,Politics
윤재옥  김행 청문회 줄행랑  가짜뉴스  권인숙 막말 때문 ,Politics
우크라 이어 이스라엘 팔레스타인까지 정부  중동정세 변화에 촉각  이 팔 전쟁 ,Politics
정청래  가결파 색출 징계 불가능 방송서 해당행위는 상응조치 ,Politics
   이재명   김포공항 이전  백지화 입장 밝혀야 ,Politics
윤희숙  퇴원하는 길  이재명  재판가면 아픈척 머리 아플것 ,Politics
홍준표   깜 도 안 되는 자들이 깐죽  하태경 천하람 직격,Politics
오늘부터 국정감사   서울 강서구청장 보선    ,Politics
조응천  이재명 당 통합 주문에  말보다 행동이 중요 ,Politics
전여옥 전원책도  김행은 안돼 조국보다 빨리 물러날듯 ,Politics
한미일   항모  레이건  동원  해양차단 대해적훈련  종합 ,Politics
 방지법 맞불     김행 도망   후보자 사퇴해  권인숙 편파진행에 청문회 끝난 것 ,Politics
  연횡책 맞설   합종책  단계는   호주 뉴질랜드,Politics
민주  대통령에  김행 지명 철회  압박  국민 입장은 부적격 ,Politics
서울 출마 하태경  나는 범친윤   의원들 서로 자기쪽으로 오지마라 하더라 ,Politics
 최강시사  정청래  하태경  마포을엔 약체 오려면 한동훈 와라 ,Politics
 도 우려하는 김행    전원책  조국보다 빨리 퇴진할 수도 ,Politics
국민의힘 이용호  김행  대통령 부담 덜어주는 것도 하나의 길 ,Politics
총선 앞 마지막 국감 여야  정국 주도권  전면전 이런정치 ,Politics
 돌쇠토론    김행 임명   강서 보궐 직후      국감 이후 ,Politics
  문정복  김행 여가부 장관 임명 철회하라 ,Politics
홍익표   하태경 서울출마  당 위해 실행한 부분 있어 그대로 평가해야 ,Politics
내년 총선 투표 정권견제          정권안정       리얼미터 ,Politics
박주민  김행 검증한 한동훈  능력없든 쓸모없든 둘 중 하나 ,Politics
여당서 하태경  마포을  출마론 제기  정청래 자객공천 ,Politics
하마스에 이스라엘 방어선 뚫리자         군사합의 재검토해야 ,Politics
 대깨문 은 가리고  쥐박이   닭근혜 는 노출  다음  필터링  논란,Politics
홍익표  사상초유 후보자 행방불명사태 심각한 국민 능멸 ,Politics
홍익표  당에 도움 안 되면 어떻게 공천 주겠는가 ,Politics
 양낙규의              이스라엘에 민항기 급파 군수송기 투입되나,Politics
내년 총선 누구 뽑겠나   정권 견제          정권 안정     ,Politics
    권인숙 방지법  발의할 것 상임위원장 중립의무 명시 ,Politics
내년 총선  정권 견제론         안정론        리얼미터 ,Politics
 김행 임명  임박했나 윤재옥  파행방지법 추진 ,Politics
지난날의 양보에  후회는 없다 는 안철수  에게는  함께 달리자 ,Politics
이준석  이재명  강서  지면 정계은퇴 감 그걸 어떻게 져 ,Politics
유상범  한동훈 예술의전당 등장은 출마와 무관      출마시키려 애써 ,Politics
 총선  년 전 선거구 획정  사문화    여야  선거제 개편  수싸움에 뒷전,Politics
정청래  하태경은 약체 마포을엔 한동훈 정도 와야 ,Politics
김태우 지원유세 나선 안철수   랄하고 자빠졌죠 ,Politics
이용호  김행  대통령 부담 덜어주는 것도 길    국민의힘 내 사퇴론 분출,Politics
 대깨문 은 가리고   닭근혜   쥐박이   굥 은 그대로     댓글 필터링 논란,Politics
여야 극단 대립에  제 지대  꿈틀  거대 양당과 합당은 없다 ,Politics
 인터뷰  권인숙  내가 막말  민주당 후보였음 더 세게 말했을 것 ,Politics
 단독    역대 최대 순방비 다 쓰고 예비비    억 또 편성,Politics
이준석  이재명  보선 지면 정계은퇴감 이걸로 진다면 말도 안 돼 ,Politics
